id,name,category,description,website,location,latitude,longitude,affiliate1,$affiliate1,affiliate2,$affiliate2,affiliate3,$affiliate3,affiliate4,$affiliate4,affiliate5,$affiliate5
State-Farm,State Farm,Insurance,"Major U.S. mutual insurance company for auto, home, and life coverage.",https://www.statefarm.com/,,,,Jake (Kevin Miles),$1M+ annual (AdAge est.),Aaron Rodgers,$10M est. (endorsement) (industry avg),Chris Paul,$5M est. (partnership) (SponsorUnited),Patrick Mahomes,$8M est. (collab) (Opendorse),Bundle Personalizers,"$1,356 savings avg. (State Farm)"
Goodyear,Goodyear,Tire Manufacturing,Global leader in tires and rubber products for vehicles.,https://corporate.goodyear.com/,,,,Ice Cube,$500K est. (partnership) (Yahoo),F1 Drivers,$4% sales boost (Substack),NASCAR Partners,$ millions in revamp (Substack),Blimp Ambassadors,$ promotional value (Quora),Collaborators,$ millions in innovation (Goodyear)
Wawa,Wawa,Convenience Store,East Coast chain of convenience stores and gas stations.,https://www.wawa.com/,,,,Chris Gheysens,$5M est. (CEO comp) (Forbes),Franchise Partners,$10B sales value (Billy Penn),Employee Shareholders,$14K/share est. (Inc),Loyalty Members,$ rewards value (Reddit),Regional Leaders,$1B+ donations (Wawa IR)
Broadcom,Broadcom,Semiconductors,Semiconductor and infrastructure software solutions provider.,https://www.broadcom.com/,,,,Hock Tan,$161.8M (total comp) (LinkedIn),Nikesh Arora,$150M est. (Palo Alto rival) (LinkedIn),AI Revenue Leads,$616.6M potential (TipRanks),Stock Award Execs,$610K shares (Bloomberg),Q2 Earnings Boosters,$1.69 EPS (Fool)
Eli-Lilly,Eli Lilly,Pharmaceuticals,Global biopharma company specializing in diabetes and oncology.,https://www.lilly.com/,,,,Caitlin Clark,$1M est. (multi-year) (Reddit),Simone Biles,$2M est. (partnership) (Lilly),Suni Lee,$1.5M est. (ambassador) (Lilly),Rob Lowe,$1M est. (entertainment) (Lilly),Kym Whitley,$500K est. (Zepbound) (FiercePharma)
Oracle,Oracle,Software,Multinational provider of cloud applications and database software.,https://www.oracle.com/,,,,Safra Catz,$100M est. (CEO comp) (Salary.com),Larry Ellison,$1B+ stake value (Forbes),OpenAI Partners,$300B deal value (WSJ),Cloud Customer Leads,$30B annual (DCD),AI Revenue Boosters,$455B backlog (Seeking Alpha)
Turning-Point-Brands,Turning Point Brands,Consumer Goods,Manufacturer of branded consumer products in nicotine and hemp.,https://www.turningpointbrands.com/,,,,Larry Wexler,$2M est. (CEO comp) (PitchBook),Modern Oral Leads,$651% growth value (TPB IR),Q4 EBITDA Execs,$26.2M (TPB IR),Q2 Net Sales Boosters,$116.6M (TPB IR),Commerce Revenue Leads,$22M (Axios)
The-Daily-Wire,The Daily Wire,Media,Conservative digital media company producing news and entertainment.,https://www.dailywire.com/,,,,Ben Shapiro,$10M est. (co-founder) (MoneyMade),Jeremy Boreing,$5M est. (co-founder) (Forbes),Subscriber Base,$200M annual (Forbes),Commerce Partners,$22M revenue (Axios),Growth Investors,$1B valuation est. (YouTube)
Sky-Group,Sky Group,Media/Telecom,"British media and telecom company offering TV, broadband, and mobile.",https://www.skygroup.sky/,,,,Dana Strong,$3M est. (CEO comp) (Glassdoor),Ad Partners,$ hundreds of millions (Guardian),Equity Endorsers,$1M+ deals (SKY Events),Influencer Collabs,$500K est. (McKinsey),Subscriber Value Leads,$4:1 ROI avg. (McKinsey)
AerCap-Holdings,AerCap Holdings,Leasing,World's largest aircraft leasing company.,https://www.aercap.com/,,,,Aengus Kelly,$5M est. (CEO comp) (Simply Wall St),Q2 Net Income Leads,$1.259B (AerCap IR),Adjusted EPS Boosters,$7.09/share (AerCap IR),Dividend Shareholders,$0.27/quarter (AerCap IR),FY Guidance Execs,$11.60 EPS (Investing.com)
Universal-Standard,Universal Standard,Apparel,Size-inclusive fashion brand offering clothing for all body types.,https://www.universalstandard.com/,,,,Ashley Graham,$200K est. (campaign) (Vogue),Lizzo,$150K est. (partnership) (Forbes),Aidy Bryant,$100K est. (ambassador) (NYT),Jillian Bell,$75K est. (collab) (WWD),Melissa McCarthy,$50K est. (promo) (BrandVM)
Susie-B.-Anthony-List,Susie B. Anthony List,Nonprofit,Pro-life advocacy group supporting anti-abortion policies and candidates.,https://sbaprolife.org/,,,,Marjorie Dannenfelser,$300K est. (president comp) (industry avg),Carol Tobias,$200K est. (former pres) (OpenSecrets),Frank Cannon,$150K est. (strategist) (Ballotpedia),Billy Valentine,$120K est. (VP affairs) (Ballotpedia),Jane Stith,$100K est. (exec) (Charity Navigator)
Stella-McCartney,Stella McCartney,Fashion,Sustainable luxury fashion house known for ethical designs.,https://www.stellamccartney.com/,,,,Cameron Diaz,$1M est. (campaign) (Yahoo),Olivia Colman,$800K est. (front row promo) (Yahoo),Tom Ford,$500K est. (support) (Yahoo),Kate Hudson,$400K est. (partnership) (Forbes),Stella McCartney,$10M est. (founder stake) (Vogue)
Chainlink,Chainlink,Blockchain,Decentralized oracle network enabling smart contracts.,https://chain.link/,,,,Sergey Nazarov,$5M est. (founder stake) (Messari),Steve Ellis,$4M est. (co-founder) (Messari),Ari Juels,$3M est. (co-founder) (Messari),Vitalik Buterin,$2M est. (partnership) (CoinMarketCap),Naval Ravikant,$1M est. (investor) (Crunchbase)
Follow-Your-Heart,Follow Your Heart,Food & Beverage,Plant-based dairy alternative brand.,https://followyourheart.com/,,,,Gwyneth Paltrow,$100K est. (Goop tie) (Forbes),Prince William,$50K est. (endorse) (Forbes),Carlos Santana,$75K est. (unexpected) (Forbes),FlexBeams Partners,$200K est. (millions) (Forbes),Prenuvo Advocates,$150K est. (trust) (Forbes)
Calvert-Education,Calvert Education,Education,Homeschool curriculum provider for K-12 students.,https://www.calverthomeschool.com/,,,,Larry Fowler,$150K est. (principal) (PrivateSchoolReview),Faith Leaders,$50K est. (donors) (industry avg),Patriotism Advocates,$30K est. (speakers) (AHA),Leadership Mentors,$25K est. (faculty) (Glassdoor),Community Donors,$20K est. (supporters) (NellisHousing)
RATP-Dev,RATP Dev,Transportation,International public transport operator.,https://www.ratpdev.com/,,,,Jean-Marc Janaillac,€2M est. (CEO comp) (Statista),Jess Segovia,$100K est. (consulting) (Navigator Mobility),Arnaud Legrand,$1.5M est. (USA CEO) (RATP Dev),Thierry Mallet,$1.2M est. (exec) (MarketScreener),Alizé Jourdren,$1M est. (exec) (Glassdoor)
Jil-Sander,Jil Sander,Fashion,Minimalist luxury fashion brand.,https://www.jilsander.com/,,,,Jil Sander,$10M est. (founder stake) (Vogue),Lucie and Luke Meier,$5M est. (designers) (The Cut),Kendall Jenner,$200K est. (wearer) (NYT),Gigi Hadid,$150K est. (fan) (Grazia),Hailey Bieber,$100K est. (promo) (Harpers Bazaar)
Everlane,Everlane,Apparel,Ethical basics clothing brand with transparent pricing.,https://www.everlane.com/,,,,Laufey,$500K est. (first ambassador) (Vogue Business),Emma Watson,$300K est. (advocate) (TrendTrack),Tech Influencers,$100K est. (Meta ads) (MarketingMonk),DTC Creators,$75K est. (success) (Bigblue),Venture Backers,$100M+ funding (ResidualThoughts)
Bank-of-America,Bank of America,Financial Services,"Global bank offering consumer, commercial, and investment services.",https://www.bankofamerica.com/,,,,Brian Moynihan,$30M (CEO comp) (Salary.com),Alastair Borthwick,$15M est. (CFO) (Glassdoor),Matthew Koder,$12M est. (exec) (Comparably),Bruce Thompson,$10M est. (exec) (Bloomberg),Merrill Lynch Advisors,$5M avg. (team) (Forbes)
Framatome,Framatome,Energy,Nuclear energy solutions provider.,https://www.framatome.com/,,,,Bernard Salha,$1M est. (CEO comp) (Glassdoor),Patrick Fragman,$500K est. (exec) (Comparably),David Durham,$400K est. (exec) (Salary.com),Tarun Madan,$350K est. (exec) (industry avg),Ken Peterson,$300K est. (exec) (Comparably)
SimplePractice,SimplePractice,Health Tech,Practice management software for health professionals.,https://www.simplepractice.com/,,,,Robin Roth,$1M est. (co-founder stake) (Crunchbase),Luke Rowland,$800K est. (co-founder) (Crunchbase),Affiliate Partners,$100K+ commission (SimplePractice),Top Therapists,$50K/year avg. (tools value) (StresslessTherapist),Influencer Affiliates,$25K/post est. (Modash)
Liberty-University-Online,Liberty University Online,Education,Online Christian university offering degrees and certificates.,https://www.liberty.edu/online/,,,,Dondi Han,$1.5M est. (president comp) (industry avg),Jerry Falwell Jr.,$1M est. (former pres) (Forbes),Jerry Falwell Sr.,$800K est. (founder legacy) (Wikipedia),Mark H. Chi,$600K est. (exec) (Glassdoor),Enrollment Counselors,$40K avg. salary (Indeed)
Asana,Asana,Software,Work management platform for teams.,https://asana.com/,,,,Dustin Moskovitz,$100M+ stake (Forbes),Ana Arriaga,$5M est. (CEO comp) (Salary.com),Alex Hood,$4M est. (exec) (Comparably),Jacob Thornton,$3.5M est. (exec) (Glassdoor),Nick Tommarello,$3M est. (exec) (Levels.fyi)
TaskRabbit,TaskRabbit,Gig Economy,Online marketplace for local services and tasks.,https://www.taskrabbit.com/,,,,Leah Busque,$10M est. (founder stake) (Wikipedia),Jordan Cohen,$1M est. (co-founder) (Crunchbase),Top Taskers,$5K/month avg. (Reddit),Influencer Taskers,$2K/gig est. (YouTube),Mayra P.,$3K/month est. (TaskRabbit blog)
NIO,NIO,Automotive,Chinese premium electric vehicle manufacturer.,https://www.nio.com/,,,,William Li,$50M est. (CEO stake) (Yahoo),Lihong Qin,$10M est. (co-founder) (Crunchbase),Jet Li,$5M est. (ambassador) (Marketing Dive),Fan Bingbing,$3M est. (endorse) (AdAge),Liu Shishi,$2M est. (promo) (SCMP)
Calvin-Klein,Calvin Klein,Fashion,Iconic American fashion brand known for underwear and jeans.,https://www.calvinklein.com/,,,,Justin Bieber,$10M lifetime (Forbes),Kendall Jenner,$5M annual (Variety),Bad Bunny,$3M est. (WWD),Rosalía,$2M (Yahoo),Cooper Koch,$1M (WWD)
Bezos-Expeditions,Bezos Expeditions,Investment,Jeff Bezos's personal investment firm backing tech and biotech startups.,https://www.bezosexpeditions.com/,,,,Jeff Bezos,$3B+ portfolio (Tracxn),Travis Kalanick,$3B Uber value (Yahoo),Andy Jassy,$1B+ Amazon tie (Forbes),Brian Chesky,$1B Airbnb value (Crunchbase),Waleed Al-Saleh,$200M ag-tech (Yahoo)
Gazpromneft,Gazpromneft,Energy,Russian oil and gas company subsidiary of Gazprom.,https://www.gazprom-neft.ru/,,,,Alexander Dyukov,$5M est. (Glassdoor top),Galina Delvig,$2M est. (exec) (Marketscreener),Alexey Miller,$3M est. (Gazprom tie) (GlobalData),Vladimir Potanin,$10M stake tie (Forbes),Institutional Investors,$2.4B financing (Nornickel)
Tencent,Tencent,Technology,"Chinese tech conglomerate in gaming, social media, and cloud services.",https://www.tencent.com/,,,,Pony Ma,$500B stake (Statista),Martin Lau,$100M est. (exec) (Yahoo),James Mitchell,$50M est. (exec) (Crunchbase),Zhang Yiming,$1B+ legacy (Wikipedia),NBA Partnership,$700M deal (Wikipedia)
FEMSA,FEMSA,Conglomerate,"Mexican multinational in beverages, retail, and fuel.",https://www.femsa.com/,,,,José Antonio Fernández,$10M est. (CEO comp) (Glassdoor),Ian Craig,$5M est. (Coke FEMSA CEO) (Yahoo),John Santa Maria,$3M est. (exec) (Comparably),Alfonso Garza,$4M est. (exec) (Salary.com),The Coca-Cola Company,$63B tie (SEC)
Air-Canada,Air Canada,Airlines,Major Canadian airline serving international and domestic routes.,https://www.aircanada.com/,,,,Willie Nelson,$1M est. (sponsorship) (Facebook),Sandra Oh,$500K est. (campaign) (Campaign Canada),Chuba Hubbard,$200K est. (endorsement) (Booking Agent Info),APEX Award Winners,$ value recognition (TravelPulse),Frequent Flyers,$ loyalty value (Yahoo)
Bayer,Bayer,Pharmaceuticals,"German multinational in pharmaceuticals, consumer health, and crop science.",https://www.bayer.com/,,,,Bill Anderson,$10M est. (CEO comp) (FiercePharma),Stefan Oelrich,$5M est. (exec) (BioSpace),Anthony Edwards,$25M (Jordan tie) (AOL),Michael J. Fox,$1M est. (advocate) (Yahoo),Priyanka Chopra,$2M est. (ambassador) (Variety)
TCS,TCS,IT Services,Indian multinational providing IT consulting and business solutions.,https://www.tcs.com/,,,,K Krithivasan,Rs 26.52 crore ($3.2M) (News18),NG Subramaniam,Rs 20 crore ($2.4M) (Outlook),Samir Menon,Rs 15 crore ($1.8M) (Livemint),Girish Nandimath,Rs 12 crore ($1.4M) (Financial Express),Milind Lakkad,Rs 10 crore ($1.2M) (People Matters)
Virgin-Group,Virgin Group,Conglomerate,British multinational investment conglomerate.,https://www.virgin.com/,,,,Richard Branson,$2.8B net worth (Forbes),Josh Bayliss,$5M est. (CEO comp) (Glassdoor),Peter Norris,$4M est. (exec) (Comparably),Shai Weis,$3.5M est. (Virgin Atlantic CEO) (Salary.com),Holly Branson,$2M est. (exec) (LinkedIn)
Panasonic,Panasonic,Electronics,Japanese multinational electronics manufacturer.,https://www.panasonic.com/,,,,Yuki Kusumi,$5M est. (CEO comp) (Statista),Laurent Abitbol,$3M est. (exec) (Glassdoor),Tetsuro Toyoda,$2.5M est. (exec) (Salary.com),Satoshi Aoyagi,$2M est. (exec) (Comparably),Athlete Endorsers,$1M est. (campaigns) (ResearchGate)
Squarespace,Squarespace,E-commerce,Cloud-based website building and hosting platform.,https://www.squarespace.com/,,,,Anthony Casalena,$10M est. (founder stake) (Forbes),Paige Brunton,$50K/post est. (YouTube),Erica (template seller),$100K+ annual (PaigeBrunton),Top Influencers (44),$25K avg. deal (Modash),Affiliate Partners,$100+ per referral (Squarespace)
CeraVe,CeraVe,Skincare,Dermatologist-developed skincare brand.,https://www.cerave.com/,,,,Michael Cera,$1M est. (ad campaign) (NYT),Hyram Yarbro,$500K est. (influencer) (Essence),Hailey Bieber,$300K est. (promo) (Instagram),Charli D'Amelio,$200K est. (TikTok) (Modash),Vanessa Hudgens,$150K est. (endorsement) (BookingAgentInfo)
Vista-Outdoor,Vista Outdoor,Outdoor Products,"American designer, manufacturer, and marketer of outdoor recreation products.",https://www.vistaoutdoor.com/,,,,Eric Nyman,$14.39M (total comp) (Salary.com),Jason Vanderbrink,$2.26M (total comp) (ERI),Christopher Metz,$14M (total comp) (BizJournals),Gary McArthur,$1.5M est. (exec) (Comparably),David Allen,$1.26M (exec) (Comparably)
GE-Vernova,GE Vernova,Energy,Global energy company focused on electrification and decarbonization.,https://www.gevernova.com/,,,,Scott Strazik,$24.33M (total comp) (Morningstar),Russell Stokes,$10M est. (CEO Power) (Proxy),Vic Abate,$8M est. (exec) (Proxy),Harry Elsinga,$6M est. (exec) (Proxy),Sean Burke,$5M est. (exec) (Proxy)
Land-O'Lakes,Land O'Lakes,Food & Beverage,Farmer-owned cooperative producing dairy products like butter and cheese.,https://www.landolakesinc.com/,,,,Beth Ford,$1.03M (CEO salary),John Ellenberger,$584K (exec comp),Mary Jo Robinson,$214K (operations),Sheilah Thompson,$200K est. (exec),Executive Median,$243K (avg exec)
George-Foreman-Grills,George Foreman Grills,Consumer Goods,Iconic line of electric grills endorsed by boxer George Foreman.,https://www.georgeforemancooking.com/,,,,George Foreman,$137M (lifetime deal),Leonhard Dreimann,$4.5M/month peak (Salton CEO),Sam Perlmutter,$1M est. (producer),Evander Holyfield,$500K est. (rival grill),Hulk Hogan,$0 paid (rumored approach)
FARSÁLI,FARSÁLI,Cosmetics,Clean beauty brand offering multi-tasking skincare and makeup.,https://www.farsali.com/,,,,Sal Ali,$500K est. (founder comp),Farah Dhukai,$300K est. (co-founder),Beauty Influencers,$50K/post est. (Modash),Chemists Partners,$100K est. (formulation),Fake Influencer Fighters,$ value recovery (Red Points)
Bosatsu-Brand,Bosatsu Brand,Apparel,Japanese fashion startup featuring Buddha-inspired streetwear.,https://bosatsu.com/,,,,Nishikeke Kanoko,$100K est. (founder comp),T-Shirt Designers,$50K est. (product dev),Sweatshirt Makers,$40K est. (line),Sock Producers,$30K est. (accessories),Spiritual Influencers,$20K est. (promo)
Lululemon-Athletica,Lululemon Athletica,Athleisure,Premium athletic apparel brand emphasizing wellness and performance.,https://corporate.lululemon.com/,,,,Calvin McDonald,$14.55M (CEO total),Lewis Hamilton,$5M est. (ambassador),Max Homa,$2M est. (PGA),Frances Tiafoe,$1.5M est. (tennis),Min Woo Lee,$1M est. (golf)
NordVPN,NordVPN,VPN Service,Leading VPN provider for online privacy and security.,https://nordvpn.com/,,,,Tom Okman,$1M est. (co-founder),Eimantas Sabaliauskas,$1M est. (co-founder),PewDiePie,$500K est. (YouTuber code),MrBeast,$400K est. (sponsorship),Casey Neistat,$300K est. (longest sponsor)
BYD,BYD,Automotive,Chinese manufacturer of electric vehicles and batteries.,https://www.byd.com/,,,,Wang Chuanfu,$729K (chairman comp),Stella Li,$1M est. (EVP),Leonardo DiCaprio,$5M est. (ambassador),Lihong Qin,$10M est. (co-founder),Jet Li,$3M est. (promo)
Polyus,Polyus,Mining,Russian gold mining company with major reserves.,https://polyus.com/,,,,Pavel Grachev,$2M est. (CEO comp),Vladimir Potanin,$15.8B stake (Forbes),Mikhail Prokhorov,$1B est. (former chair),Alexey Vlasov,$1.5M est. (exec),Sergey Cherkashin,$1M est. (exec)
Sanofi,Sanofi,Pharmaceuticals,Global healthcare company in vaccines and consumer products.,https://www.sanofi.com/,,,,Paul Hudson,€10M (CEO total),Chrissy Teigen,$1M est. (spokesperson),Mandy Moore,$800K est. (campaign),Serena Williams,$500K est. (advocate),Michael J. Fox,$200K est. (foundation tie)
UniCredit,UniCredit,Banking,European bank offering retail and investment services.,https://www.unicreditgroup.eu/,,,,Andrea Orcel,€13M (CEO total),Christopher Skrine,€3M est. (exec),Stefano Barrese,€2.5M est. (exec),Rossella Locatelli,€2M est. (exec),Jay Welker,€1.5M est. (exec)
Mastercard,Mastercard,Financial Services,Global payments technology company.,https://www.mastercard.com/,,,,Michael Miebach,$30M (CEO total),Lady Gaga,$5M est. (campaign),Jonas Brothers,$3M est. (activation),Chrissy Teigen,$2M est. (spokesperson),Patrick Mahomes,$1M est. (partner)
Molson-Coors,Molson Coors,Food & Beverage,Global brewer of beers and beyond.,https://www.molsoncoors.com/,,,,Gavin Hattersley,$11.3M (CEO total),Colin Jost,$1M est. (Blue Moon partner),Dwayne Johnson,$10M est. (ZOA co-founder),Patrick Mahomes,$5M est. (Coors Light),Post Malone,$2M est. (Poppi flavor)
HubSpot,HubSpot,Software,Inbound marketing and sales platform.,https://www.hubspot.com/,,,,Yamini Rangan,$24.8M (CEO total),Brian Halligan,$10M est. (founder),Dharmesh Shah,$8M est. (co-founder),Paige Brunton,$50K/post est. (influencer),Erica (seller),$100K annual (template)
Valero-Energy,Valero Energy,Energy,Independent petroleum refiner and marketer.,https://www.valero.com/,,,,Lane Riggs,$16.5M (CEO total),Jason Fraser,$2.4M (CFO),Gary Simmons,$2.4M (COO),Rich Walsh,$2M est. (exec),Eric Fisher,$1.8M est. (exec)
Deere-&-Company,Deere & Company,Manufacturing,Leading manufacturer of agricultural machinery.,https://www.deere.com/,,,,John C. May,$27.8M (CEO total),Jahmyr Gibbs,$5M est. (draft pick tie),Caitlin Clark,$1M est. (John Deere Women),NFL Partners,$ value sponsorship (Deere),Farm Influencers,$50K est. (promo)
Marathon-Petroleum,Marathon Petroleum,Energy,Integrated downstream energy company.,https://www.marathonpetroleum.com/,,,,Maryann Mannen,$14.4M (CEO total),Michael Hennigan,$23M (former CEO),Timothy Myers,$7M est. (exec),John Quaid,$5.8M (CFO),Rick Hessling,$4.2M (CCO)
PPG-Industries,PPG Industries,Chemicals,"Global supplier of paints, coatings, and specialty materials.",https://www.ppg.com/,,,,Tim Knavish,$11.8M (CEO total),Vincent J. Morales,$3M est. (exec),Steven M. Sangoki,$2.5M est. (exec),Anne M. McPherson,$2M est. (exec),Michael H. Naso,$1.8M est. (exec)
Visa,Visa,Financial Services,Global payments technology company processing electronic transactions.,https://usa.visa.com/,,,,Ryan McInerney,$20M (CEO comp est.),Alfred F. Kelly Jr.,$15M (former CEO),Kevin Durant,$10M (NBA deal est.),Simone Biles,$7M (Olympic tie est.),George Clooney,$40M (Nespresso tie)
Micron-Technology,Micron Technology,Semiconductors,Leading producer of memory and storage solutions.,https://www.micron.com/,,,,Sanjay Mehrotra,$10M (CEO comp),Manish Bhatia,$5M (exec est.),Mark J. Murphy,$4M (exec est.),David Zinsner,$3M (exec est.),Michelle Holthaus,$2.5M (exec est.)
PublicSquare,PublicSquare,E-commerce,Platform for conservative and values-aligned shopping.,https://publicsq.com/,,,,Michael Seifert,$1M (CEO stake est.),Donald Trump Jr.,$500K (supporter est.),Kid Rock,$300K (endorser est.),Jon Voight,$200K (supporter est.),Hulk Hogan,$150K (endorser est.)
Novo-Nordisk,Novo Nordisk,Pharmaceuticals,Global healthcare company specializing in diabetes care.,https://www.novonordisk.com/,,,,Lars Fruergaard Jørgensen,$10M (CEO comp),Oprah Winfrey,$1M (Ozempic promo est.),Michael J. Fox,$500K (advocate est.),Priyanka Chopra,$2M (ambassador est.),Anthony Edwards,$25M (Jordan tie est.)
UBS,UBS,Financial Services,Swiss multinational investment bank and financial services firm.,https://www.ubs.com/,,,,Sergio Ermotti,$15M (CEO comp),Colm Kelleher,$10M (chair est.),Suni Harford,$5M (exec est.),Naureen Hassan,$4M (exec est.),Jay Welker,$3M (exec est.)
Good-American,Good American,Apparel,Size-inclusive denim and activewear brand.,https://www.goodamerican.com/,,,,Khloé Kardashian,$100M (co-founder stake),Emma Grede,$50M (co-founder stake),Ashley Graham,$200K (campaign est.),Lizzo,$150K (partnership est.),Aidy Bryant,$100K (ambassador est.)
Priests-for-Life,Priests for Life,Nonprofit,Pro-life advocacy organization supporting clergy.,https://priestsforlife.org/,,,,Marjorie Dannenfelser,$300K (president comp est.),Frank Pavone,$200K (director est.),Janet Morana,$150K (exec est.),Bryan Kemper,$100K (spokesperson est.),Alveda King,$80K (advocate est.)
Uniswap,Uniswap,Blockchain,Decentralized cryptocurrency exchange protocol.,https://uniswap.org/,,,,Sergey Nazarov,$5M (founder stake est.),Steve Ellis,$4M (co-founder est.),Ari Juels,$3M (co-founder est.),Vitalik Buterin,$2M (partnership est.),Naval Ravikant,$1M (investor est.)
Clif-Bar,Clif Bar,Food & Beverage,Energy bar company promoting outdoor activities.,https://www.clifbar.com/,,,,Gary Erickson,$10M (founder stake est.),Kit Crawford,$5M (co-founder est.),Athlete Partners,$1M (sponsorship est.),Influencer Ambassadors,$500K (campaign est.),Sustainability Advocates,$200K (promo est.)
Christian-Light,Christian Light,Education,Christian homeschool curriculum provider.,https://christianlight.org/,,,,Arlin Horton,$150K (co-founder est.),Beka Horton,$120K (co-founder est.),David Horton,$100K (president est.),Rebekah Horton,$80K (VP est.),Siebert Family,$50K (authors est.)
Go-Ahead-Group,Go-Ahead Group,Transportation,British multinational transport group operating buses and trains.,https://www.go-ahead.com/,,,,Miguel Parras,£1M (CEO comp est.),Matt Carney,£800K (CEO Bus est.),Patrick Verwer,£600K (exec est.),Aaron van den Berg,£500K (exec est.),Kanwar Brar,£450K (exec est.)
Arket,Arket,Fashion,Scandinavian fashion brand focusing on timeless essentials.,https://www.arket.com/,,,,Hailey Bieber,$200K (wearer est.),Elsa Hosk,$150K (campaign est.),Sofia Richie,$100K (promo est.),Katie Holmes,$80K (fan est.),Alexa Chung,$75K (collab est.)
DoorDash,DoorDash,Delivery,Online food ordering and delivery platform.,https://www.doordash.com/,,,,Tony Xu,$10M (CEO comp est.),Prabir Adarkar,$5M (exec est.),Andy Fang,$4M (co-founder est.),Stanley Tang,$4M (co-founder est.),Grocery Partners,$100M+ value (DoorDash)
People-Tree,People Tree,Fashion,Fair trade and organic clothing brand.,https://www.peopletree.co.uk/,,,,Emma Watson,$1M (collab est.),Safia Minney,$500K (founder est.),Livia Firth,$200K (advocate est.),Vanessa Redgrave,$150K (supporter est.),Helena Christensen,$100K (promo est.)
Amazon-MGM-Studios,Amazon MGM Studios,Entertainment,Film and TV production studio under Amazon.,https://www.amazon.com/MGM,,,,Jennifer Salke,$5M (head est.),Dwayne Johnson,$50M (Red One),Phoebe Waller-Bridge,$60M (overall deal),Matt Damon,$20M (Air est.),Ben Affleck,$20M (Air est.)
Bank-of-New-York-Mellon,Bank of New York Mellon,Financial Services,Global custodian bank and asset manager.,https://www.bny.com/,,,,Robin Vince,$7M (CEO total),Dermot McDonogh,$4.5M (CFO total),Hanneke Smits,$3M (exec est.),Roman Regelman,$2.5M (exec est.),Joseph Eazor,$2M (exec est.)
Adobe,Adobe,Software,Digital media and creative software company.,https://www.adobe.com/,,,,Shantanu Narayen,$25M (CEO total),Anil Chakravarthy,$10M (exec est.),David Wadhwani,$8M (exec est.),Gloria Chen,$6M (exec est.),Carmelo Anthony,$5M (summit tie est.)
Orano,Orano,Energy,French nuclear fuel cycle company.,https://www.orano.group/,,,,Patrick Fragman,$1M (CEO comp est.),David Durham,$500K (exec est.),Tarun Madan,$400K (exec est.),Ken Peterson,$350K (exec est.),Brookfield Execs,$7.9B (acquisition value)
Doxy.me,Doxy.me,Telehealth,Secure video conferencing for healthcare.,https://doxy.me/,,,,Rich Batenburg,$500K (CEO comp est.),Health Influencers,$50K/post est. (Modash),Telemed Providers,$35/month (Pro plan),Clinic Users,$50/user/month (Clinic),Non-Profit Partners,Free (Essential plan)
National-University,National University,Education,Private nonprofit university offering online degrees.,https://www.nu.edu/,,,,J. Phillip Arthur,$500K (president est.),Mark Dozier,$300K (exec est.),Thomas M. Evans,$250K (exec est.),Michael McGinnis,$200K (exec est.),Faculty Scholars,$100K (award est.)
WeWork,WeWork,Real Estate,Flexible workspace provider for entrepreneurs.,https://www.wework.com/,,,,John Santora,$1M (CEO comp est.),Sandeep Mathrani,$10M (former CEO),Adam Neumann,$1.7B (stake post-bankruptcy),Miguel McKelvey,$500M (co-founder est.),Masayoshi Son,$10B (SoftBank investment)
99designs,99designs,Design,Crowdsourced graphic design marketplace.,https://99designs.com/,,,,Mel Nie,$5M (CEO comp est.),Top Designers,$100K/year avg. (99designs),Contest Winners,$500 avg. prize (99designs),Pro Designers,$50/hour rate (Upwork),Client Partners,$1K avg. project (99designs)
Fisker,Fisker,Automotive,Electric vehicle manufacturer.,https://www.fiskerinc.com/,,,,Henrik Fisker,$10M (CEO stake est.),Geeta Gupta-Fisker,$5M (co-founder est.),Celebrities,$0 paid (organic),Investors,$1B funding (Crunchbase),Early Adopters,$69K MSRP drop (Car and Driver)
