id,name,category,description,website,location,latitude,longitude,affiliate1,$affiliate1,affiliate2,$affiliate2,affiliate3,$affiliate3,affiliate4,$affiliate4,affiliate5,$affiliate5
Apple,Apple,Electronics,Consumer electronics company,https://apple.com,,,,Taylor Swift,Multi-million,"Dwayne ""The Rock"" Johnson",$5-10 million,Oprah Winfrey,$5 million+,Samuel L. Jackson,$3-5 million,Nick Jonas,$2-3 million
Uber,Uber,Uber,Global on-demand transportation and delivery platform.,https://www.uber.com/,,,,Bradley Cooper,$10M (Super Bowl est.),Antonio Banderas,$5M (Super Bowl est.),Jude Law,$5M (Super Bowl est.),Travis Scott,$1M (McDonald's tie est.),Amy Schumer,$1M (Tampax tie est.)
Hobby-Lobby,Hobby Lobby,Hobby Lobby,"Arts, crafts, and home decor retailer.",https://www.hobbylobby.com/,,,,Donald Trump,$17K (donation),Kamala Harris,$5.9K (donation),Ron DeSantis,$7K (donation),Mark Walker,$5.3K (donation),Tatertots & Jello,$10K (influencer est.)
The-Walt-Disney-Company,The Walt Disney Company,The Walt Disney Company,Global media and entertainment conglomerate.,https://thewaltdisneycompany.com/,,,,Dwayne Johnson,$88M (earnings),Tom Cruise,$100M (top gun tie),Jason Statham,$50M (grossing est.),Pedro Pascal,$40M (supporting est.),Joseph Quinn,$30M (leading est.)
Tesla,Tesla,Tesla,Electric vehicle and clean energy company.,https://www.tesla.com/,,,,Elon Musk,$500B (net worth tie),Kimbal Musk,$1B (stake est.),Larry Ellison,$500M (stake est.),Ron Baron,$200M (investor),Ron Perelman,$100M (investor)
Nike,Nike,Nike,Global athletic footwear and apparel brand.,https://www.nike.com/,,,,Cristiano Ronaldo,$275M (total),Stephen Curry,$156M (total),LeBron James,$135M (total),Lionel Messi,$135M (total),Jon Rahm,$218M (golf)
Universal-Music-Group,Universal Music Group,Universal Music Group,World's leading music company.,https://www.universalmusic.com/,,,,Taylor Swift,$200M (deal est.),The Weeknd,$300M (deal est.),Drake,$400M (multi-album),Morgan Wallen,$100M (album debut est.),Playboi Carti,$80M (album est.)
Spotify,Spotify,Spotify,Music and podcast streaming service.,https://www.spotify.com/,,,,Joe Rogan,$250M (extension),Alex Cooper,$125M (deal),Steven Bartlett,$50M (Diary of a CEO),Jordan Peterson,$30M (JBP Podcast),Bill Simmons,$20M (Simmons Podcast)
Trump-Organization,Trump Organization,Trump Organization,Real estate development and licensing company.,https://www.trump.com/,,,,Elon Musk,$500B (net worth tie),Miriam Adelson,$100M (donation),Tim Mellon,$50M (donation),Richard Uihlein,$40M (donation),Jeff Yass,$30M (donation)
Costco-Wholesale,Costco Wholesale,Costco Wholesale,Membership warehouse club chain.,https://www.costco.com/,,,,Craig Jelinek,$10M (former CEO),Richard Galanti,$5M (CFO),Patrick Callans,$3M (exec),Mark Zuckerberg,$0 (organic shopper),Billie Eilish,$0 (organic fan)
Smith-&-Wesson,Smith & Wesson,Smith & Wesson,American firearms manufacturer.,https://www.smith-wesson.com/,,,,Jerry Miculek,$100K (sponsorship),Travis Halvorsen,$50K (influencer),Taran Butler,$75K (training),NRA Affiliates,$200K (advocacy),Gun YouTubers,$25K/post (promo)
NextEra-Energy,NextEra Energy,NextEra Energy,World's largest renewable energy producer.,https://www.nexteraenergy.com/,,,,John Ketchum,$5M (CEO),Rebecca Kujawa,$3M (exec),Armando Pimentel,$2.5M (exec),Mark Thayer,$2M (exec),Florida Power Execs,$1.5M (exec)
Lockheed-Martin,Lockheed Martin,Lockheed Martin,Global security and aerospace company.,https://www.lockheedmartin.com/,,,,James Taiclet,$18M (CEO),Jesus Malave,$10M (exec),Stephanie Hill,$8M (exec),Tom Cruise,$0 (Top Gun organic),Harrison Ford,$0 (films organic)
REI,REI,REI,Outdoor recreation retailer and co-op.,https://www.rei.com/,,,,Arc'teryx Exec,$1M (partnership),Vuori Founder,$800K (apparel),Gregory Exec,$600K (hardgoods),Atomic Exec,$500K (action sports),KEEN Exec,$400K (footwear)
Chick-fil-A,Chick-fil-A,Chick-fil-A,Chicken sandwich fast-food chain.,https://www.chick-fil-a.com/,,,,Dan Cathy,$10M (CEO),Bubba Cathy,$5M (exec),Trudy Cathy,$3M (exec),Big Boi,$0 (supporter),Luke Bryan,$0 (promo)
Huda-Beauty,Huda Beauty,Huda Beauty,Makeup brand founded by Huda Kattan.,https://hudabeauty.com/,,,,Huda Kattan,$10M (founder),Kendall Jenner,$5M (partnership),Rihanna,$3M (est.),Kylie Jenner,$2M (est.),Selena Gomez,$1.5M (est.)
Estée-Lauder,Estée Lauder,Estée Lauder,Luxury beauty conglomerate.,https://www.elcompanies.com/,,,,Priyanka Chopra,$10M (lifetime),Kendall Jenner,$5M (annual),Gwyneth Paltrow,$3M (annual),Paulina Porizkova,$2M (global),Shu Qi,$1M (global spokesperson)
Headspace,Headspace,Headspace,Meditation and mindfulness app.,https://www.headspace.com/,,,,John Legend,$1M (campaign),Harry Styles,$500K (series),Kevin Hart,$400K (partnership),Jessica Alba,$300K (investor),Gwyneth Paltrow,$200K (supporter)
USAA,USAA,USAA,Military-focused financial services.,https://www.usaa.com/,,,,Wayne Peacock,$5M (CEO),Rob Grogan,$3M (exec),Sam Elliott,$2M (ads),Drew Brees,$1.5M (campaign),Larry Fitzgerald,$1M (initiative)
Boeing,Boeing,Boeing,Global aerospace manufacturer.,https://www.boeing.com/,,,,David Calhoun,$30M (former CEO),Stanley Deal,$10M (exec),Theodore Colbert,$8M (exec),Tom Cruise,$0 (Top Gun),Harrison Ford,$0 (films)
Procter-&-Gamble,Procter & Gamble,Consumer Goods,"Multinational corporation producing personal care, household, and hygiene products.",https://us.pg.com/,,,,Tiger Woods,$105 million (researchgate.net),Derek Jeter,$10 million,Maria Sharapova,$8 million,Pharrell Williams,$5 million,Kate Upton,$3 million
X,X,Social Media,Microblogging platform for real-time public conversations and news sharing.,https://x.com/,,,,Elon Musk,$44 billion (acquisition),Taylor Swift,$0 (organic visibility),MrBeast,$0 (organic),Kim Kardashian,$0 (organic),Barack Obama,$0 (organic)
Proton,Proton,Privacy Tech,"Provider of end-to-end encrypted email, VPN, and cloud services.",https://proton.me/,,,,Tim Berners-Lee,Undisclosed (endorsement),Andy Yen,Undisclosed (founder),Jason Stockman,Undisclosed (co-founder),N/A,N/A,N/A,N/A
Gazprom,Gazprom,Energy,Russian state-owned multinational focused on natural gas production and distribution.,https://www.gazprom.com/,,,,Alexey Miller,Undisclosed (CEO contract),Vladimir Putin,$0 (state affiliation),Alisher Usmanov,Undisclosed (en.wikipedia.org),N/A,N/A,N/A,N/A
Elbit-Systems,Elbit Systems,Defense Tech,"Global provider of advanced defense, homeland security, and aerospace systems.",https://www.elbitsystems.com/,,,,Bezhalel Machlis,Undisclosed (CEO),N/A,N/A,N/A,N/A,N/A,N/A,N/A,N/A
LVMH,LVMH,Luxury Goods,"French conglomerate owning prestigious brands in fashion, wines, and cosmetics.",https://www.lvmh.com/,,,,Rihanna,$100 million+ Fenty (amraandelma.com),Zendaya,Undisclosed LV (voguebusiness.com),Robert Pattinson,Undisclosed Dior (theenterpriseworld.com),Pharrell Williams,Undisclosed (LV),Emma Stone,Undisclosed (LV)
Eni,Eni,Energy,"Italian integrated energy company focused on oil, gas, and renewable exploration.",https://www.eni.com/,,,,Claudio Descalzi,Undisclosed (CEO),N/A,N/A,N/A,N/A,N/A,N/A,N/A,N/A
Toyota,Toyota,Automotive,"Japanese multinational manufacturer of vehicles, hybrids, and mobility solutions.",https://global.toyota/en/,,,,Shohei Ohtani,Undisclosed (uk.finance.yahoo.com),Naomi Osaka,$5 million,Kei Nishikori,Undisclosed,Sydney Sweeney,Undisclosed (campaign),Beyoncé,$0 (organic)
Adidas,Adidas,Sportswear,German multinational corporation designing athletic and casual apparel and footwear.,https://www.adidas-group.com/,,,,Lionel Messi,$25 million/year (fandomwire.com),David Beckham,$160 million lifetime (thegentlemansjournal.com),James Harden,$200 million (brandvm.com),Damian Lillard,Lifetime deal (wwd.com),Patrick Mahomes,$100 million (aol.com)
Fidelity-Investments,Fidelity Investments,Financial Services,"Provider of investment management, retirement planning, and brokerage services.",https://www.fidelity.com/,,,,Peter Lynch,Undisclosed (former manager),Abigail Johnson,Undisclosed (CEO),N/A,N/A,N/A,N/A,N/A,N/A
ExxonMobil,ExxonMobil,Oil & Gas,"American integrated energy company engaged in exploration, production, and refining.",https://corporate.exxonmobil.com/,,,,Darren Woods,Undisclosed (CEO),N/A,N/A,N/A,N/A,N/A,N/A,N/A,N/A
JPMorgan-Chase,JPMorgan Chase,Financial Services,"Global leader in banking, investment, and asset management services.",https://www.jpmorganchase.com/,,,,Stephen Curry,$2 million/year (Forbes),Jamie Dimon,Undisclosed (CEO contract),LeBron James,Undisclosed (NBA tie-in),Kevin Durant,Undisclosed (NBA tie-in),N/A,N/A
Caterpillar,Caterpillar,Heavy Machinery,"Manufacturer of construction, mining equipment, engines, and turbines.",https://www.caterpillar.com/,,,,D. James Umpleby,Undisclosed (CEO),Vanguard Group,$19.2 billion (stake value),State Street,$15.1 billion (stake value),BlackRock,$9.8 billion (stake value),N/A,N/A
Hershey-Company,Hershey Company,Confectionery,"Producer of chocolate, candy, snacks, and confectionery products.",https://www.thehersheycompany.com/,,,,Angel Reese,Undisclosed (Reese's deal),Chance the Rapper,Undisclosed (KitKat ad),N/A,N/A,N/A,N/A,N/A,N/A
NVIDIA,NVIDIA,Semiconductors,Designer of graphics processing units and AI computing platforms.,https://www.nvidia.com/,,,,Jensen Huang,Undisclosed (CEO stake),Vanguard Group,$100B+ (stake value),BlackRock,$80B+ (stake value),Mark A. Stevens,Undisclosed (co-founder),Tench Coxe,Undisclosed (co-founder)
Vanguard,Vanguard,Investment Management,"Provider of low-cost index funds, ETFs, and investment services.",https://www.vanguard.com/,,,,Tim Buckley,Undisclosed (CEO),Mortimer J. Buckley,Undisclosed (former CEO),John C. Bogle,Undisclosed (founder legacy),N/A,N/A,N/A,N/A
Tucker-Carlson-Network,Tucker Carlson Network,Media Network,Independent platform for conservative commentary and interviews.,https://tuckercarlson.com/,,,,Tucker Carlson,$15 million (seed funding),Neil Patel,Undisclosed (partner),PublicSq,$1 million+ (ad deal),N/A,N/A,N/A,N/A
Rumble,Rumble,Video Platform,"Free-speech video hosting, sharing, and monetization service.",https://rumble.com/,,,,Steven Crowder,Undisclosed (top earner),Dan Bongino,Undisclosed (top earner),Russell Brand,Undisclosed (top earner),N/A,N/A,N/A,N/A
Comcast,Comcast,Telecommunications,"Provider of broadband, cable TV, and media entertainment services.",https://corporate.comcast.com/,,,,Brian Roberts,Undisclosed (CEO stake),N/A,N/A,N/A,N/A,N/A,N/A,N/A,N/A
Fox-Corporation,Fox Corporation,Media Conglomerate,"Owner of news, sports, and entertainment broadcasting networks.",https://www.foxcorporation.com/,,,,Lachlan Murdoch,Undisclosed (CEO),Rupert Murdoch,Undisclosed (founder),N/A,N/A,N/A,N/A,N/A,N/A
Smurfit-WestRock,Smurfit WestRock,Packaging,Global sustainable packaging and paperboard solutions provider.,https://www.smurfitwestrock.com/,,,,Tony Smurfit,Undisclosed (CEO),N/A,N/A,N/A,N/A,N/A,N/A,N/A,N/A
Goldman-Sachs,Goldman Sachs,Investment Banking,"Global firm offering investment banking, securities, and management.",https://www.goldmansachs.com/,,,,David Solomon,Undisclosed (CEO),N/A,N/A,N/A,N/A,N/A,N/A,N/A,N/A
Palantir-Technologies,Palantir Technologies,Data Analytics,AI-driven software for data integration and decision-making.,https://www.palantir.com/,,,,Alex Karp,Undisclosed (CEO stake),Peter Thiel,Undisclosed (co-founder),Joe Lonsdale,Undisclosed (co-founder),Stephen Cohen,Undisclosed (co-founder),N/A,N/A
BlackRock,BlackRock,Asset Management,World's largest asset manager with ETFs and investment solutions.,https://www.blackrock.com/,,,,Larry Fink,Undisclosed (CEO),N/A,N/A,N/A,N/A,N/A,N/A,N/A,N/A
Fenty-Beauty,Fenty Beauty,Cosmetics,Inclusive beauty brand offering makeup for all skin tones.,https://fentybeauty.com/,,,,Rihanna,$600 million (Forbes),A$AP Rocky,Undisclosed (Forbes),Lizzo,Undisclosed (Variety),SZA,Undisclosed (Vogue),Rosalía,Undisclosed (Vogue)
Patagonia,Patagonia,Outdoor Apparel,Sustainable outdoor clothing and gear manufacturer.,https://www.patagonia.com/,,,,Yvon Chouinard,Undisclosed (company founder),Alex Honnold,Undisclosed (ambassador),Rose Marcario,Undisclosed (former CEO),Kristen Ulmer,Undisclosed (ambassador),Ryan Gelb,Undisclosed (ambassador)
Microsoft,Microsoft,Technology,"Developer of software, hardware, and cloud services.",https://www.microsoft.com/,,,,Satya Nadella,Undisclosed (CEO),Bill Gates,$100B+ (stake value),Steven Spielberg,Undisclosed (ads),Trevor Noah,Undisclosed (spokesperson),Megan Thee Stallion,Undisclosed (Copilot)
Beyond-Meat,Beyond Meat,Plant-Based Food,Producer of plant-based meat alternatives.,https://www.beyondmeat.com/,,,,Ethan Brown,Undisclosed (CEO),Snoop Dogg,Undisclosed (investor),Leonardo DiCaprio,Undisclosed (investor),Chris Paul,Undisclosed (investor),Kyrie Irving,Undisclosed (investor)
Abeka,Abeka,Education,Provider of Christian homeschool curriculum.,https://www.abeka.com/,,,,Arlin Horton,Undisclosed (co-founder),Beka Horton,Undisclosed (co-founder),David Horton,Undisclosed (president),Rebekah Horton,Undisclosed (vice president),Siebert Family,Undisclosed (authors)
Keolis,Keolis,Transportation,Operator of public transport systems worldwide.,https://www.keolis.com/,,,,Alizé Jourdren,Undisclosed (CEO),Abdellah Chajai,Undisclosed (CEO NA),Jean-Eudes Trelay,Undisclosed (CFO),Fabrice Ferrandes,Undisclosed (exec),Rachel Picard,Undisclosed (exec)
The-Row,The Row,Luxury Fashion,Minimalist ready-to-wear clothing brand.,https://www.therow.com/,,,,Mary-Kate Olsen,Undisclosed (co-founder),Ashley Olsen,Undisclosed (co-founder),Kendall Jenner,Undisclosed (ambassador),Gigi Hadid,Undisclosed (fan),Hailey Bieber,Undisclosed (fan)
Shopify,Shopify,E-commerce Platform,Platform for building and managing online stores.,https://www.shopify.com/,,,,Tobias Lütke,Undisclosed (CEO),Kylie Jenner,Undisclosed (merchant),Rihanna,Undisclosed (Fenty store),Hailey Bieber,Undisclosed (Rhode store),Selena Gomez,Undisclosed (Rare Beauty)
Netflix,Netflix,Streaming Service,On-demand entertainment streaming platform.,https://www.netflix.com/,,,,Ryan Murphy,$300 million (deal),Shonda Rhimes,$150 million (deal),Dwayne Johnson,$50 million (film),Zack Snyder,Undisclosed (director),Bela Bajaria,Undisclosed (exec)
Publix,Publix,Grocery Retail,Employee-owned supermarket chain in the Southeast US.,https://www.publix.com/,,,,Kevin Murphy,Undisclosed (CEO),Lee Thornton,Undisclosed (CFO),D. Todd Jones,Undisclosed (former CEO),Roger Barrett,Undisclosed (exec),John Comer,Undisclosed (exec)
Yelp,Yelp,Review Platform,Local business reviews and discovery service.,https://www.yelp.com/,,,,Jeremy Stoppelman,Undisclosed (CEO),Aaron Schur,Undisclosed (co-founder),Laconia Gomez,Undisclosed (elite reviewer),Top Elite Reviewers,N/A,Community Elites,N/A
Meta-Platforms,Meta Platforms,Social Media,Operator of social networking platforms.,https://about.meta.com/,,,,Mark Zuckerberg,$100B+ (stake value),Sheryl Sandberg,Undisclosed (former COO),Chris Cox,Undisclosed (CTO),Nick Clegg,Undisclosed (president),Javier Olivan,Undisclosed (COO)
Google,Google,Technology,"Global leader in internet services, search, and AI technologies.",https://www.google.com/,,,,Sundar Pichai,Undisclosed (CEO),Bill Gates,Undisclosed (investor),MrBeast,Undisclosed (YouTube star),Larry Page,Undisclosed (co-founder),Sergey Brin,Undisclosed (co-founder)
Constellation-Energy,Constellation Energy,Energy,Largest U.S. producer of carbon-free energy from nuclear plants.,https://www.constellationenergy.com/,,,,Joe Dominguez,Undisclosed (CEO),Mark Zuckerberg,Undisclosed (Meta deal),Satya Nadella,Undisclosed (Microsoft deal),N/A,N/A,N/A,N/A
Teladoc-Health,Teladoc Health,Telehealth,Provider of virtual healthcare services and medical consultations.,https://www.teladoc.com/,,,,Jason Gorevic,Undisclosed (CEO),David Sides,Undisclosed (former CEO),Mala Murthy,Undisclosed (exec),N/A,N/A,N/A,N/A
McDonald's,McDonald's,Fast Food,"Global chain offering quick-service hamburgers, fries, and beverages.",https://www.mcdonalds.com/,,,,Travis Scott,Undisclosed (Forbes),Angel Reese,Undisclosed (CNN),BTS,Undisclosed (TheTakeout),LeBron James,Undisclosed (mcdo-menu-guide),Serena Williams,Undisclosed (mcdo-menu-guide)
K11,K12,Education,Provider of online K-12 curriculum and virtual schooling solutions.,https://www.k12.com/,,,,James Rhyu,Undisclosed (CEO),Gregory L. Ricks,Undisclosed (exec),Michael J. Klein,Undisclosed (exec),N/A,N/A,N/A,N/A
Zoom,Zoom,Video Conferencing,Cloud-based platform for video communications and online meetings.,https://zoom.us/,,,,Eric Yuan,Undisclosed (CEO),Bill Murray,Undisclosed (ads),Jane Doe,Undisclosed (spokesperson),N/A,N/A,N/A,N/A
Upwork,Upwork,Freelance Platform,Online marketplace connecting businesses with freelance professionals.,https://www.upwork.com/,,,,Hayden Brown,Undisclosed (CEO),Stephane Kasriel,Undisclosed (former CEO),N/A,N/A,N/A,N/A,N/A,N/A
OWN,OWN,Media Network,Cable network focused on lifestyle programming for African American women.,https://www.oprah.com/app/own-network.html,,,,Oprah Winfrey,Undisclosed (founder),Tyler Perry,Undisclosed (PRNewswire),Gayle King,Undisclosed (host),N/A,N/A,N/A,N/A
Amazon,Amazon,E-commerce,World's largest online retailer and cloud computing services provider.,https://www.amazon.com/,,,,Jeff Bezos,Undisclosed (founder),Andy Jassy,Undisclosed (CEO),Reese Witherspoon,Undisclosed (Hello Sunshine),Alix Earle,Undisclosed (InfluencerMarketingHub),Rocky Barnes,Undisclosed (Feedspot)
Alibaba,Alibaba,E-commerce,"Chinese multinational specializing in e-commerce, retail, and technology.",https://www.alibaba.com/,,,,Jack Ma,Undisclosed (founder),Daniel Zhang,Undisclosed (former CEO),Daymond John,Undisclosed (judge),Lori Greiner,Undisclosed (judge),Simu Liu,Undisclosed (judge)
Telmex,Telmex,Telecommunications,Mexican telecommunications company providing fixed-line and internet services.,https://www.telmex.com/,,,,Carlos Slim,Undisclosed (owner),Héctor Slim Seade,Undisclosed (CEO),N/A,N/A,N/A,N/A,N/A,N/A
Tim-Hortons,Tim Hortons,Coffee Chain,Canadian quick-service restaurant chain known for coffee and baked goods.,https://www.timhortons.com/,,,,Justin Bieber,Undisclosed (BrandVM),Ryan Reynolds,Undisclosed (BrandVM),Mark Lee,Undisclosed (BookingAgentInfo),Maitreyi Ramakrishnan,Undisclosed (BookingAgentInfo),N/A,N/A
HSBC,HSBC,Banking,International banking and financial services institution.,https://www.hsbc.com/,,,,Noel Quinn,Undisclosed (CEO),George Osborne,Undisclosed (former advisor),N/A,N/A,N/A,N/A,N/A,N/A
Volkswagen,Volkswagen,Automotive,German multinational automotive manufacturer of cars and commercial vehicles.,https://www.vw.com/,,,,Christian Pulisic,Undisclosed (HotCars),Adam Scott,Undisclosed (VW Media),Michael Peña,Undisclosed (VW Media),Christopher Mintz-Plasse,Undisclosed (VW Media),Oliver Blume,Undisclosed (CEO)
Tata-Group,Tata Group,Conglomerate,Indian multinational conglomerate holding company with diverse business interests.,https://www.tata.com/,,,,Virat Kohli,Undisclosed (Livemint),Shah Rukh Khan,Undisclosed (MediaAnt),Akshay Kumar,Undisclosed (MediaAnt),Amitabh Bachchan,Undisclosed (Statista),Ratan Tata,Undisclosed (founder)
Airbnb,Airbnb,Hospitality,"Online marketplace enabling people to list, discover, and book accommodations.",https://www.airbnb.com/,,,,Beyoncé,Undisclosed (Bloomberg),Mariah Carey,Undisclosed (Bloomberg),Megan Thee Stallion,Undisclosed (Variety),Sabrina Carpenter,Undisclosed (Variety),Kevin Hart,Undisclosed (Influencer Intelligence)
SpaceX,SpaceX,Aerospace,Private American aerospace manufacturer and space transportation company.,https://www.spacex.com/,,,,Elon Musk,Undisclosed (CEO),Gwynne Shotwell,Undisclosed (President),Tom Cruise,Undisclosed (film project),Larry Page,Undisclosed (investor),Sergey Brin,Undisclosed (investor)
SpringHill-Company,SpringHill Company,Media Production,"Entertainment company producing film, TV, and digital content.",https://www.springhillcompany.com/,,,,LeBron James,$725 million (LA Times),Maverick Carter,Undisclosed (co-founder),Stephen Curry,Undisclosed (Sportico),Kevin Durant,Undisclosed (Sportico),Barack Obama,Undisclosed (content partner)
Live-Nation,Live Nation,Entertainment,"Global live events company promoting concerts, tours, and festivals.",https://www.livenation.com/,,,,Taylor Swift,Undisclosed (Prestige),Beyoncé,Undisclosed (Billboard),Ed Sheeran,Undisclosed (tour promoter),Jay-Z,Undisclosed (Roc Nation),Madonna,Undisclosed (tour)
Onnit,Onnit,Health & Wellness,"Provider of supplements, fitness gear, and wellness products.",https://www.onnit.com/,,,,Joe Rogan,Undisclosed (Squarespace),Aubrey Marcus,Undisclosed (founder),Jocko Willink,Undisclosed (ambassador),Tim Ferriss,Undisclosed (endorser),Mark Sisson,Undisclosed (partner)
Trump-Media-&-Technology-Group,Trump Media & Technology Group,Media,Media and technology company operating the Truth Social platform.,https://www.tmtgcorp.com/,,,,Donald Trump,Undisclosed (founder),Devin Nunes,Undisclosed (CEO),Kid Rock,Undisclosed (supporter),Jon Voight,Undisclosed (endorser),Hulk Hogan,Undisclosed (endorser)
Kaiser-Permanente,Kaiser Permanente,Healthcare,Nonprofit health plan and hospital system providing integrated care.,https://www.kaiserpermanente.org/,,,,Gregory Adams,Undisclosed (CEO),Stephen Curry,Undisclosed (NBA partner),Klay Thompson,Undisclosed (NBA partner),Draymond Green,Undisclosed (NBA partner),Andrew Wiggins,Undisclosed (NBA partner)
"Sturm,-Ruger-&-Co.","Sturm,Firearms,https://logo.clearbit.com/ruger.com,Leading American manufacturer of pistols", revolvers, rifles," and shotguns.""",,,,https://www.ruger.com/,Bill Ruger,Undisclosed (founder),Christopher J. Killoy,Undisclosed (CEO),Kevin Sardone,Undisclosed (exec),Mark Lang,Undisclosed (exec),Tom Whitney,Undisclosed (exec)
Ørsted,Ørsted,Renewable Energy,Danish energy company specializing in offshore wind farms and green energy.,https://orsted.com/,,,,Mads Nipper,Undisclosed (CEO),Daniel Lerup,Undisclosed (exec),Richard Sandberg,Undisclosed (exec),Henrik Andersen,Undisclosed (exec),Jeppe Borch,Undisclosed (exec)
Ben-&-Jerry's,Ben & Jerry's,Food & Beverage,Vermont-based company producing ice cream and frozen desserts.,https://www.benjerry.com/,,,,Jerry Garcia,Undisclosed (CNBC),Stephen Colbert,Undisclosed (Bob-FM),Yoko Ono,Undisclosed (CNBC),Colin Kaepernick,Undisclosed (Influencer Intelligence),Jimmy Fallon,Undisclosed (Influencer Intelligence)
Levi-Strauss-&-Co.,Levi Strauss & Co.,Apparel,Global apparel company best known for inventing blue jeans.,https://www.levistrauss.com/,,,,Beyoncé,$5 million (WWD),Jaden Smith,Undisclosed (The Drum),Marcus Rashford,Undisclosed (The Drum),Emma Chamberlain,Undisclosed (The Drum),Xiye Bastida,Undisclosed (The Drum)
The-Home-Depot,The Home Depot,Home Improvement Retail,Largest home improvement retailer in the United States.,https://www.homedepot.com/,,,,Shaquille O'Neal,Undisclosed (HBS Dealer),Ted Decker,Undisclosed (CEO),Ann-Marie Campbell,Undisclosed (exec),Hector Mejia,Undisclosed (exec),Paula Drake,Undisclosed (exec)
RTX,RTX,Aerospace & Defense,Multinational aerospace and defense technology company.,https://www.rtx.com/,,,,Christopher Calio,Undisclosed (CEO),Gregory Hayes,Undisclosed (former CEO),Tom Cruise,Undisclosed (Top Gun),Will Smith,Undisclosed (Independence Day),Harrison Ford,Undisclosed (films)
Peloton,Peloton,Fitness Equipment,Connected fitness platform offering interactive workouts.,https://www.onepeloton.com/,,,,Beyoncé,Undisclosed (NoGood),Serena Williams,Undisclosed (IIDE),Kim Kardashian,Undisclosed (Forbes),Ashton Kutcher,Undisclosed (Forbes),Cody Rigsby,Undisclosed (Time)
Calm,Calm,Mental Health,"Leading app for sleep, meditation, and relaxation.",https://www.calm.com/,,,,Harry Styles,Undisclosed (app series),Matthew McConaughey,Undisclosed (narrator),LeBron James,Undisclosed (endorser),Kelly Rowland,Undisclosed (narrator),Tamra Davis,Undisclosed (contributor)
Kroger,Kroger,Grocery Retail,American retail company operating supermarkets and multi-department stores.,https://www.kroger.com/,,,,Rodney McMullen,Undisclosed (CEO),Valerie Wehrenberg,Undisclosed (exec),Carin Mrotz,Undisclosed (exec),Mary Ellen Adcock,Undisclosed (exec),Tim McCoy,Undisclosed (exec)
Signal,Signal,Messaging,Cross-platform encrypted messaging service for secure communication.,https://signal.org/,,,,Edward Snowden,Undisclosed (endorser),Elon Musk,Undisclosed (recommender),Jack Dorsey,Undisclosed (supporter),Moxie Marlinspike,Undisclosed (founder),Meredith Whittaker,Undisclosed (president)
Rosneft,Rosneft,Oil & Gas,Russian multinational oil company engaged in exploration and production.,https://www.rosneft.com/,,,,Igor Sechin,Undisclosed (CEO),Vladimir Putin,Undisclosed (state affiliate),Alisher Usmanov,Undisclosed (investor),Matthias Warnig,Undisclosed (exec),Lee Young-soo,Undisclosed (partner)
Rafael-Advanced-Defense-Systems,Rafael Advanced Defense Systems,Defense Tech,Israeli company developing advanced weapon systems and defense technologies.,https://www.rafael.co.il/,,,,Yoav Har-Even,Undisclosed (GlobalData),Lior Carmeli,Undisclosed (Dealroom),Eyal Walter,Undisclosed (Tracxn),David McKeown,Undisclosed (GA Partnership),Yossi Levy,Undisclosed (exec)
Airbus,Airbus,Aerospace,"European aerospace manufacturer of commercial aircraft, helicopters, and space systems.",https://www.airbus.com/,,,,Guillaume Faury,Undisclosed (Airbus Report),Lars Wagner,Undisclosed (AviTrader),Roberto Cingolani,Undisclosed (Executive Bulletin),Thomas Toepfer,Undisclosed (Airbus),Julie Kitcher,Undisclosed (exec)
Ferrari,Ferrari,Automotive,Italian luxury sports car manufacturer renowned for high-performance vehicles.,https://www.ferrari.com/,,,,Charles Leclerc,Undisclosed (Feedspot),Carlos Sainz,Undisclosed (Feedspot),Nicholas Hoult,Undisclosed (BookingAgentInfo),Ben Simmons,Undisclosed (BookingAgentInfo),Michael B. Jordan,Undisclosed (BookingAgentInfo)
