id,name,category,description,website,location,latitude,longitude,affiliate1,$affiliate1,affiliate2,$affiliate2,affiliate3,$affiliate3,affiliate4,$affiliate4,affiliate5,$affiliate5
Anheuser-Busch,Anheuser-Busch,Food & Beverage,Global brewer of beers including Budweiser and Michelob Ultra.,https://www.anheuser-busch.com/,,,,David Beckham,$10M/year (Budweiser) (AdAge),Serena Williams,$5M+ est. (Bud Light) (SponsorUnited),Kylian Mbappé,$2M+ est. (FIFA) (SeattleTimes),Post Malone,$1M+ est. (Bud Light) (AdAge),Tracee Ellis Ross,Undisclosed (Bud Light) (PRNewswire)
The-Boring-Company,The Boring Company,Infrastructure,Infrastructure and tunnel construction company focused on urban transit solutions.,https://www.boringcompany.com/,,,,Elon Musk,Undisclosed (founder) (BuiltIn),Steve Davis,Undisclosed (president) (NashvilleBanner),Sequoia Capital,$500M+ investment (Clay),State of Tennessee,Undisclosed (Music City) (TucMagazine),AREA15,Undisclosed (LVCC tour) (FTE)
Beats-by-Dre,Beats by Dre,Consumer Electronics,Premium audio brand known for headphones and wireless earbuds.,https://www.beatsbydre.com/,,,,Dr. Dre,$33M (royalties) (Forbes),Jay-Z,$2.5B net from deals (CEO Today),LeBron James,$10M+ lifetime (AVADA),Serena Williams,$5M+ est. (AVADA),Lil Wayne,$5M+ est. (Forbes list)
AT&T,AT&T,Telecommunications,"Leading provider of wireless, broadband, and digital TV services.",https://www.att.com/,,,,Luke Wilson,Undisclosed (ads) (MediaPost),Rose Zhang,Undisclosed (Masters) (iSpot),Jordan Spieth,Undisclosed (Masters) (iSpot),Creed Bratton,Undisclosed (Office ads) (MediaPost),Angela Kinsey,Undisclosed (Office ads) (MediaPost)
Manscaped,Manscaped,Personal Care,Men's grooming brand specializing in below-the-waist products.,https://www.manscaped.com/,,,,Pete Davidson,Undisclosed (ambassador/shareholder) (MarketingDive),TooTurntTony,$386K engagements (SponsorUnited),DJ Khaled,Undisclosed (past) (GrowthNotes),Natural Selection Tour,Undisclosed (partner) (Manscaped),"Influencers (2,000+)",$3.3M total (NeoReach)
Daniel-Defense,Daniel Defense,Firearms,Manufacturer of high-performance firearms and accessories.,https://danieldefense.com/,,,,Marty Daniel,Undisclosed (founder) (Instagram),SLG2 Inc.,Undisclosed (partner) (OutdoorWire),IACP Law Enforcement,Undisclosed (exhibit) (Instagram),GOALS Summit,Undisclosed (exhibitor) (GunOwners),Exec Team,Undisclosed (internal) (LinkedIn)
Enphase-Energy,Enphase Energy,Renewable Energy,Provider of solar microinverters and energy management systems.,https://enphase.com/,,,,Vanguard Group,$1B+ stake (Fintel),BlackRock,$800M+ stake (Fintel),Baillie Gifford,$318M stake (MarketScreener),Invesco Ltd.,$239M stake (MarketScreener),GAMMA Investing,$ small stake (MarketBeat)
General-Dynamics,General Dynamics,Aerospace & Defense,Aerospace and defense contractor providing advanced technologies.,https://www.gd.com/,,,,Phebe Novakovic,Undisclosed (CEO) (Reuters),US Army Futures Command,$1.25B contract (Reuters),CDC,$309M contract (GovConWire),STRATCOM,$1.5B contract (Reuters),Shield AI,Undisclosed (partner) (Euro-SD)
Equal-Exchange,Equal Exchange,Food & Beverage,Worker-owned co-op specializing in fair trade organic foods.,https://www.equalexchange.coop/,,,,Michael Rozyne,Undisclosed (co-founder) (Tracxn),Rink Dickinson,Undisclosed (co-founder) (Tracxn),Farmer Orgs (40+),Undisclosed (partners) (EqualExchange),Joshua Pitts,Undisclosed (co-founder) (Tracxn),Alternative Trader,Undisclosed (profile) (EqualExchange)
Forever-20,Forever 21,Apparel,Fast-fashion retailer offering trendy clothing for young adults.,https://www.forever21.com/,,,,Saweetie,Undisclosed (holiday collab) (Essence),Kimora Lee Simmons,Undisclosed (Baby Phat) (LicenseGlobal),Alix Earle,Undisclosed (Juicy Couture) (People),BTS,Undisclosed (Lee collab) (Denimology),Frankie and the Studs,Undisclosed (festival) (Authentic)
INIKA-Organic,INIKA Organic,Cosmetics,Certified organic and vegan beauty brand focused on clean skincare.,https://www.inikaorganic.com/,,,,Robyn Lawley,Undisclosed (ambassador) (StyleCaster),Nicole Trunfio,Undisclosed (ambassador) (INIKA),Supermodel Activists,Undisclosed (general) (INIKA),Goldyn Otay,Undisclosed (ambassador) (Instagram),Award Winners,Undisclosed (Green Beauty) (INIKA)
Buddha-Groove,Buddha Groove,Retail,Online retailer of spiritual and mindfulness products like jewelry and decor.,https://www.buddhagroove.com/,,,,Emily Fletcher,Undisclosed (influencer) (Modash),Manon Lanza,Undisclosed (influencer) (Modash),Londrelle,Undisclosed (influencer) (Modash),Adam Woolard,Undisclosed (influencer) (Modash),Hannah Ciordas,Undisclosed (influencer) (Modash)
Ford,Ford,Automotive,"American automaker producing trucks, SUVs, and electric vehicles.",https://www.ford.com/,,,,Sydney Sweeney,Undisclosed (endorsement) (Quartz),Beyoncé,Undisclosed (campaign) (Quartz),Harrison Ford,Undisclosed (Jeep tie-in est.) (NYPost),J.D. Power,Undisclosed (awards) (FromTheRoad),Truck Buyers,Undisclosed (loyalty) (FordAuthority)
Robinhood,Robinhood,Fintech,"Commission-free trading app for stocks, options, and crypto.",https://robinhood.com/,,,,Elon Musk,Undisclosed (influencer) (SovereignBoss),Chamath Palihapitiya,Undisclosed (influencer) (SovereignBoss),Cathie Wood,Undisclosed (influencer) (SovereignBoss),Dave Portnoy,Undisclosed (influencer) (SovereignBoss),Ray Dalio,Undisclosed (influencer) (SovereignBoss)
Under-Armour,Under Armour,Athleisure,Performance apparel and footwear brand for athletes.,https://www.underarmour.com/,,,,Stephen Curry,$215M (11-year) (BrandVM),Tom Brady,Undisclosed (lifetime) (CaptainCreps),Jordan Spieth,Undisclosed (golf) (UnderArmour),Dwayne Johnson,Undisclosed (global) (CaptainCreps),Cam Ward,Undisclosed (NFL draft) (UnderArmour)
Mullvad,Mullvad,Privacy Tech,Privacy-focused VPN service emphasizing anonymity and no-logs policy.,https://mullvad.net/,,,,Jan Jonsson,Undisclosed (CEO) (Mullvad),Obscura VPN,Undisclosed (partner) (Mullvad),Edward Snowden,$0 paid (supporter est.) (PrivacyGuides),WireGuard Devs,Undisclosed (tech) (Mullvad),Resellers,Undisclosed (distributors) (Mullvad)
Novatek,Novatek,Energy,Russian natural gas producer and LNG exporter.,https://www.novatek.ru/,,,,Leonid Mikhelson,Undisclosed (CEO) (GlobalData),Alexander Nazarov,Undisclosed (IR head) (GlobalData),Institutional Investors,$ large stake (PitchBook),Taaleri,Undisclosed (investor) (Tracxn),Alfa Fortress,Undisclosed (investor) (Tracxn)
Raytheon-Technologies,Raytheon Technologies,Aerospace & Defense,Advanced aerospace and defense technology provider (RTX).,https://www.rtx.com/,,,,Christopher Calio,Undisclosed (CEO) (RTX),Shield AI,Undisclosed (partner) (RTX),Avio USA,$26M (rocket) (RTX),MELCO,$250M (ESSM) (RTX),Anduril,Undisclosed (test) (RTX)
Renault,Renault,Automotive,French multinational automobile manufacturer known for electric and hybrid vehicles.,https://www.renault.com/,,,,Rafael Nadal,$1M+ est. (Roland-Garros) (Medium),Dua Lipa,Undisclosed (general auto) (EnterpriseWorld),Robert Pattinson,Undisclosed (fashion tie) (EnterpriseWorld),Luca de Meo,Undisclosed (CEO) (Yahoo),George Russell,$5M/year est. (F1) (Spotrac)
Enel,Enel,Energy,Italian multinational energy company focused on renewables and electricity distribution.,https://www.enel.com/,,,,Flavio Cattaneo,€5M/year est. (Statista),Enel Américas Execs,Undisclosed (presentation) (Enel),Claudio Descalzi,Undisclosed (Eni tie) (Enel),Investor Shareholders,€1B+ value (Webull),Sustainability Partners,Undisclosed (initiatives) (Enel)
SoftBank,SoftBank,Investment,Japanese multinational holding company investing in tech startups and telecom.,https://group.softbank/en/,,,,Masayoshi Son,Undisclosed (founder) (Yahoo),Naomi Osaka,$45M net worth (Facebook),Rihanna,Undisclosed (LV collab tie) (EnterpriseWorld),Dua Lipa,Undisclosed (Versace) (EnterpriseWorld),Robert Pattinson,Undisclosed (Dior) (EnterpriseWorld)
Dunkin'-Brands,Dunkin' Brands,Food & Beverage,Global chain of coffeehouses and doughnut shops.,https://www.dunkindonuts.com/,,,,Ben Affleck,$10M (Super Bowl) (CNN),Jeremy Strong,Undisclosed (Super Bowl) (Yahoo),Casey Affleck,Undisclosed (Super Bowl) (Yahoo),Will Arnett,Undisclosed (ads) (NRN),Joey Fatone,Undisclosed (ads) (NRN)
Southwest-Airlines,Southwest Airlines,Airlines,Major U.S. low-cost carrier offering domestic and international flights.,https://www.southwest.com/,,,,Justin Bieber,Undisclosed (influencer) (MarketingDive),Bob Jordan,Undisclosed (CEO) (Travel+Leisure),Influencer Network,$100K+ est. (campaigns) (MarketingDive),Frequent Flyers,Undisclosed (loyalty) (Yahoo),Premium Travelers,Undisclosed (upgrades) (Yahoo)
Royal-Caribbean-International,Royal Caribbean International,Travel,Global cruise line operator with innovative ships and destinations.,https://www.royalcaribbean.com/,,,,Michael Bay,Undisclosed (Icon promo) (RoyalCaribbeanBlog),Celebrity Cruises Execs,Undisclosed (sister brand) (RoyalCaribbeanBlog),Jason Liberty,Undisclosed (CEO) (Reuters),Silversea Partners,Undisclosed (luxury) (RoyalCaribbean),Cruise Influencers,$50K+ est. (onboard) (RoyalCaribbean)
Walgreens-Boots-Alliance,Walgreens Boots Alliance,Retail,International pharmacy-led health and wellbeing enterprise.,https://www.walgreensbootsalliance.com/,,,,Rosalind Brewer,Undisclosed (former CEO) (Fortune),Sycamore Partners,$23.7B acquisition (CNN),Tim Wentworth,Undisclosed (CEO) (Yahoo),Private Equity Investors,Undisclosed (stake) (Yahoo),Pharmacy Advocates,Undisclosed (campaigns) (WBA)
Progressive,Progressive,Insurance,Major U.S. auto insurance company known for competitive rates.,https://www.progressive.com/,,,,Flo (Stephanie Courtney),$1M+ annual (AdAge est.),Jamie Lee Curtis,$5M est. (campaigns) (FandomWire),Rick Perry,Undisclosed (spokesperson) (AdAge),Mayhem (Dean Winters),Undisclosed (character) (AdAge),Influencer Partners,$100K+ est. (EnterpriseWorld)
Giant-Eagle,Giant Eagle,Grocery Retail,Regional supermarket chain in the Northeastern U.S.,https://www.gianteagle.com/,,,,Laura Shapira Karet,Undisclosed (CEO) (KSN),GetGo Sellers,$1.6B sale (TribLive),Store Renovation Team,$100M investment (KSN),Value Product Buyers,Undisclosed (300+ items) (Yahoo),Community Partners,Undisclosed (local) (GiantEagle)
Blackstone-Group,Blackstone Group,Investment,World's largest alternative asset manager.,https://www.blackstone.com/,,,,Stephen Schwarzman,$253M/year (Forbes),TPG Partners,$700B+ deals (Morningstar),Private Equity Firms,Undisclosed (buyouts) (Morningstar),Jonathan Gray,$100M+ package (Bloomberg),Distributable Earnings,$1.9B Q3 (TipRanks)
Ford-Motor-Company,Ford Motor Company,Automotive,"Iconic American automaker producing trucks, SUVs, and EVs.",https://www.ford.com/,,,,Harrison Ford,Undisclosed (Jeep ad) (NYPost),Sydney Sweeney,Undisclosed (endorsement) (Quartz),Beyoncé,Undisclosed (campaign) (Quartz),Jeter (Derek),Undisclosed (past) (Quartz),Powell (Rashad),Undisclosed (past) (Quartz)
HarperCollins,HarperCollins,Publishing,Global publisher of books across genres and imprints.,https://www.harpercollins.com/,,,,MrBeast,$1M+ advance est. (Deadline),James Patterson,Undisclosed (co-author) (HarperCollins),AI Licensing Authors,$2.5K per title (AuthorsGuild),Spring Authors,Undisclosed (anticipated) (HarperCollins),Microsoft Partners,$5K per title (Musically)
AstraZeneca,AstraZeneca,Pharmaceuticals,Global biopharmaceutical company focused on oncology and rare diseases.,https://www.astrazeneca.com/,,,,Pascal Soriot,Undisclosed (CEO) (AstraZeneca),US Manufacturing,$50B investment (BioSpace),R&D Partners,Undisclosed (growth) (AstraZeneca),Q2 Earnings Team,Undisclosed (results) (AstraZeneca),CER Growth Investors,Undisclosed (presentation) (AstraZeneca)
National-Right-to-Life,National Right to Life,Nonprofit,Leading pro-life advocacy organization in the U.S.,https://www.nrlc.org/,,,,Carol Tobias,Undisclosed (president) (OpenSecrets),Top Contributors,$21K cycle (OpenSecrets),Lobbying PACs,$153K spending (OpenSecrets),Maggie's List PAC,Undisclosed (endorsements) (NRLC),Pro-Life Candidates,$485K outside (OpenSecrets)
Allbirds,Allbirds,Apparel,Sustainable footwear brand using natural materials.,https://www.allbirds.com/,,,,Leonardo DiCaprio,Undisclosed (investor) (MarketingMonk),Emma Watson,Undisclosed (advocate) (TrendTrack),Tech Influencers,Undisclosed (Meta ads) (MarketingMonk),DTC Creators,Undisclosed (success) (Bigblue),Venture Backers,$100M+ funding (ResidualThoughts)
Bitfinex,Bitfinex,Cryptocurrency,Cryptocurrency exchange platform for trading and finance.,https://www.bitfinex.com/,,,,Kim Kardashian,$250K (past fine) (DigitalCurrencyTraders),Snoop Dogg,$100M+ holdings (FinanceMonthly),Akon,Undisclosed (holdings) (FinanceMonthly),Justin Bieber,Undisclosed (holdings) (FinanceMonthly),Floyd Mayweather,Undisclosed (holdings) (FinanceMonthly)
Gardein,Gardein,Food & Beverage,Plant-based meat alternative brand.,https://www.gardein.com/,,,,Gwyneth Paltrow,Undisclosed (Goop tie) (Forbes),Prince William,Undisclosed (endorse est.) (Forbes),Carlos Santana,Undisclosed (unexpected) (Forbes),FlexBeams Partners,Undisclosed (millions) (Forbes),Prenuvo Advocates,Undisclosed (trust) (Forbes)
Foundation-Worldview,Foundation Worldview,Education,Provider of biblical worldview curriculum for homeschool families.,https://foundationworldview.com/,,,,David Ruark,$150K est. (founder comp) (industry avg),Linda Ruark,$120K est. (co-founder) (industry avg),Sarah Mackenzie,$50K est. (influencer collab) (homeschool market),Jamie Martin,$40K est. (curriculum partner) (affiliate est.),Andrew Pudewa,$30K est. (guest instructor) (event fees)
ComfortDelGro,ComfortDelGro,Transportation,Leading multi-modal land transport operator in Asia.,https://www.comfortdelgro.com/,,,,Lim Jit Poh,S$2.95M (total comp) (Simply Wall St),Cheng Siak Kian,$1.5M est. (exec) (Glassdoor avg),Bernard Tay,$1.2M est. (exec) (Yahoo Finance),Yee Lok Chong,$1M est. (exec) (MarketScreener),Stanley Leow,$900K est. (exec) (Statista)
Filippa-K,Filippa K,Fashion,Swedish minimalist clothing brand promoting sustainable fashion.,https://www.filippa-k.com/,,,,Elin Kling,$500K est. (co-founder stake) (Vogue),Sofia Richie,$200K est. (campaign) (Forbes fashion),Katie Holmes,$150K est. (ambassador) (NYT endorsement avg),Meghan Markle,$100K est. (wearer promo) (Harpers Bazaar),Alexa Chung,$75K est. (fan collab) (Grazia)
Facebook,Facebook,Social Media,Leading social networking platform connecting billions worldwide.,https://www.facebook.com/,,,,Mark Zuckerberg,$27.2M (total comp) (Salary.com),Javier Olivan,$25.5M (total comp) (Salary.com),Christopher Cox,$23.6M (total comp) (Salary.com),Sheryl Sandberg,$20M est. (former COO) (Statista),Kylie Jenner,$12.5K-25K/post (Shopify influencers)
Sony-Pictures,Sony Pictures,Entertainment,Major film and television studio producing global content.,https://www.sonypictures.com/,,,,Dwayne Johnson,$20M+ (film deals) (Variety),Scarlett Johansson,$40M+ (ties) (Variety),Chris Pratt,$15M+ (Jurassic) (Variety),Julia Roberts,$20M est. (BuzzFeed),Timothée Chalamet,$12M max (Forbes 2025 highest)
Westinghouse,Westinghouse,Energy,Provider of nuclear power generation technologies and services.,https://www.westinghousenuclear.com/,,,,Patrick Fragman,$235K avg (Comparably exec),David Durham,$200K est. (exec) (Glassdoor),Tarun Madan,$180K est. (exec) (industry avg),Ken Peterson,$160K est. (exec) (Salary.com),Brookfield Execs,$7.9B stake value (Cameco acquisition)
Included-Health,Included Health,Healthcare,Platform for personalized virtual care and health navigation.,https://includedhealth.com/,,,,Tom Ferry,$427K max (Comparably exec),David Sides,$397K (telemed physician) (Indeed),Mala Murthy,$200K est. (exec) (Glassdoor),Kathleen Barnes,$150K est. (exec) (Levels.fyi),Jason Gorevic,$114K min (former CEO est.) (Comparably)
American-Heritage-Academy,American Heritage Academy,Education,Principle-based Christian private school emphasizing faith and leadership.,https://ahalv.org/,,,,Larry Fowler,$150K est. (principal comp) (PrivateSchoolReview),Faith Leaders,$50K est. (donors) (industry avg),Patriotism Advocates,$30K est. (speakers) (AHA events),Leadership Mentors,$25K est. (faculty) (Glassdoor education),Community Donors,$20K est. (supporters) (NellisHousing)
Dropbox,Dropbox,Technology,Cloud storage and file-sharing platform for individuals and teams.,https://www.dropbox.com/,,,,Drew Houston,$1.71M (total comp) (Simply Wall St),Arash Ferdowsi,$1.5M est. (co-founder) (Comparably),Quentin Clark,$503K max (exec) (Comparably),Sarah Franklin,$400K est. (exec) (Glassdoor),Adi Sidler,$350K est. (exec) (Levels.fyi)
Guru,Guru,Affiliate Marketing,Exclusive CPA affiliate network for media and marketing campaigns.,https://gurumedia.com/,,,,Zac Johnson,$1M+ annual (top affiliate) (InfluencerMarketingHub),Pat Flynn,$800K est. (SmartPassiveIncome),Jeremy Shoemaker,$500K est. (Shoemoney) (Growave),John Chow,$400K est. (Chow.com) (Growave),Kirsty McCubbin,$300K est. (top earner) (InfluencerMarketingHub)
Hyundai-Ioniq,Hyundai Ioniq,Automotive,"Lineup of innovative hybrid, plug-in hybrid, and electric vehicles.",https://www.hyundai.com/us/en/vehicles/ioniq-5,,,,Ryan Reynolds,$10M est. (ads) (Hyundai general),Jennifer Lopez,$5M+ (Super Bowl) (Hyundai),BTS,$3M est. (global) (Hyundai),John Krasinski,$2M est. (ads) (Hyundai),Randall Park,$1.5M est. (ads) (Hyundai)
Discovery-Channel,Discovery Channel,Media,"Cable network dedicated to science, nature, and adventure programming.",https://www.discovery.com/,,,,Mike Rowe,$16M (host est.) (Forbes TV hosts),Bear Grylls,$15M est. (Man vs. Wild) (Forbes),Richard Hammond,$12M est. (Grand Tour) (Forbes),Jeremy Clarkson,$10M est. (Grand Tour) (Forbes),James May,$10M est. (Grand Tour) (Forbes)
Audible,Audible,Audiobooks,Leading provider of digital audiobooks and podcasts.,https://www.audible.com/,,,,James Patterson,$1M+ advances (Deadline),Colleen Hoover,$800K est. (royalties) (Audible),Narrators (top),$100K+ PFH (YouTube rates),Podcast Hosts,$500K est. (exclusives) (Audible),Celebrity Narrators,$200K est. (premium) (Jane Friedman)
China-Mobile,China Mobile,Telecommunications,Largest mobile network operator in China providing ICT services.,https://www.chinamobileltd.com/,,,,Yang Jie,$234K median (Comparably),Li Yue,$200K est. (CEO) (Simply Wall St),Biao He,$91K est. (exec) (Simply Wall St),Wai Lan Wong,$150K est. (secretary) (Marketscreener),Rong Hua Li,$180K est. (exec) (Marketscreener)
Canadian-Tire,Canadian Tire,Retail,"Iconic Canadian retailer offering automotive, home, and sports products.",https://www.canadiantire.ca/,,,,D. Michael Medline,$8.8M (CEO comp) (Simply Wall St),Greg Hicks,$6.49M est. (former CEO) (Hardlines),Neil McDonald,$2M est. (exec) (Glassdoor),Stephen Wetzel,$1.5M est. (exec) (Comparably),David Court,$1.2M est. (exec) (Payscale)
BP,BP,Energy,"Multinational integrated energy company focused on oil, gas, and renewables.",https://www.bp.com/,,,,Murray Auchincloss,$1.83M (salary),Bernard Looney,$12M (total comp),Bob Dudley,$19.6M (total comp),Kate Thomson,$1M (base est.),Helge Lund,$5M (chair est.)
Deutsche-Telekom,Deutsche Telekom,Telecommunications,"German multinational telecom providing mobile, broadband, and digital services.",https://www.telekom.com/,,,,Tim Höttges,$2.3M (total comp),Mike Sievert,$1.4M (base),Dominik Asam,$3M (CFO est.),Claudia Nemat,$2M (exec est.),Srini Gopalan,$2.5M (CEO Americas est.)
Zee-Entertainment,Zee Entertainment,Media,"Indian media conglomerate in TV, film, and digital entertainment.",https://www.zee.com/,,,,Punit Goenka,$1.99M (total comp),R Gopalan,$1.5M (exec est.),Ashish Agarwal,$1M (exec est.),Divya Karani,$800K (director est.),Saurav Adhikari,$700K (director est.)
L.L.-Bean,L.L. Bean,Retail,Iconic American outdoor apparel and gear retailer.,https://www.llbean.com/,,,,Stephen Smith,$700K (max exec est.),Shawn Gorman,$1M (chair est.),Sarah Jane McCabe,$800K (exec est.),Employee Owners,$9% bonus avg.,Store Expansion Leads,$60 stores value
Capital-One,Capital One,Financial Services,"Leading U.S. bank offering credit cards, loans, and banking services.",https://www.capitalone.com/,,,,Richard Fairbank,$30M (award),Kevin Borgmann,$10M (CFO est.),Charles Hallac,$8M (exec est.),Samuel L. Jackson,$5M (spokesperson est.),Miles Transfer Users,1.85 cpp value
SimpliSafe,SimpliSafe,Home Security,Provider of DIY wireless home security systems and monitoring.,https://simplisafe.com/,,,,Christian Cerda,$575K (max exec est.),Chad Laurans,$1M (founder est.),Eleanor Laurans,$1M (co-founder est.),GTCR Investors,$1B+ acquisition value,Business Security Leads,$ tailored solutions est.
Colt,Colt,Technology,Global digital infrastructure provider for connectivity and cloud.,https://www.colt.net/,,,,Keri Gilder,$450K (max exec est.),Jean-Marc Harion,$1.5M (former CEO est.),Challenger Leaders,$ Gartner quadrant value,Winners Circle Execs,$ award recognition,Technology Challengers,$3rd year Gartner
Iberdrola,Iberdrola,Energy,Spanish multinational electric utility focused on renewables.,https://www.iberdrola.com/,,,,Ignacio Galán,€3.3M (CEO comp),Mario Ruiz-Tagle,€3M (exec est.),AGM Shareholders,€ massive support,Grid Investors,€120B plan,UK/US Grid Partners,€58B spending
Ocean-Spray,Ocean Spray,Food & Beverage,Farmer-owned cooperative producing cranberry products.,https://www.oceanspray.com/,,,,Tom Washington,$450K (max exec est.),Co-op Growers,$59.6K PAC receipts,Community Fund Leads,$ grants impact,Insurance Policy Holders,$ coverage value,Shareholder Members,$275K cash on hand
Wendy's,Wendy's,Fast Food,International fast-food chain known for square hamburgers.,https://www.wendys.com/,,,,Kirk Tanner,$17.3M (total comp),Gunther Plosch,$2.26M (total comp),Robert Wright,$2.08M (total comp),E.J. Wunsch,$1.04M (total comp),Abigail E.,$1.3M (total comp est.)
PHB-Ethical-Beauty,PHB Ethical Beauty,Cosmetics,"Ethical, vegan, and cruelty-free beauty brand.",https://www.phbethicalbeauty.com/,,,,Founder Team,$200K (startup comp est.),Vegan Influencers,$50K (campaigns est.),Halal Cosmetics Leads,$1.9B market,Green Beauty Winners,$ awards value,Organic Advocates,$5.04B vegan market
Phat-Buddha,Phat Buddha,Retail,Scottish sneaker and streetwear retailer.,https://www.fatbuddhastore.com/,,,,Alissa Benishai,$100K (CEO comp est.),Advisors (Benishai),$50K (consulting est.),Dustin Humphrey,$ collaboration value,Offspring Stores,$ store numbers value,Visualsoft Partners,$ eCommerce value
BAE-Systems,BAE Systems,Aerospace & Defense,"British multinational defense, security, and aerospace company.",https://www.baesystems.com/,,,,Charles Woodburn,£11.68M (total comp),Bradley Greve,£2.43M (total comp),Brad Greve,£2M (exec est.),Apprentices/Graduates,£1B skills investment,US Contract Winners,$ large orders value
Mondragon-Corporation,Mondragon Corporation,Conglomerate,World's largest worker cooperative federation in the Basque Country.,https://www.mondragon-corporation.com/,,,,Iñigo Ucin,€200K (president comp est.),Worker Members,€6x salary cap,Co-op Founders,€ democratic value,Global Partners,€ knowledge-sharing,Community Leaders,€70K members
MyFitnessPal,MyFitnessPal,Health Tech,"Mobile app for tracking nutrition, exercise, and weight goals.",https://www.myfitnesspal.com/,,,,Under Armour Execs,$5M est. (partnership value) (industry avg),Influencer Ambassadors,$50K/post est. (BookingAgentInfo),Premium Users,$1.4M memberships (Yahoo),Education Partners,$100K est. (recognition prog),App Developers,$200K est. (feature collabs) (Business of Apps)
ExpressVPN,ExpressVPN,VPN Service,Premium VPN provider for secure and private internet browsing.,https://www.expressvpn.com/,,,,Tucker Carlson,$100K est. (show promo) (ExpressVPN),Streamers/YouTubers,$0.089/view avg. (Reddit),Influencers (40+),$50K/post est. (Modash),Affiliate Partners,$100+ per ad (Reddit),Top Streamers,$2.2M/month est. (HeySeva)
Nornickel,Nornickel,Mining,World's largest producer of nickel and palladium.,https://nornickel.com/,,,,Vladimir Potanin,$10M est. (CEO stake) (Forbes),Alexey Miller,$5M est. (exec) (GlobalData),Institutional Investors,$2.4B financing (Nornickel),Dividend Shareholders,$1B+ annual (Nornickel IR),Supply Chain Partners,$12.5B revenue share (Nornickel)
BNP-Paribas,BNP Paribas,Banking,French multinational investment bank and financial services firm.,https://group.bnpparibas/en/,,,,Jean-Laurent Bonnafé,€4.3M (total comp) (Simply Wall St),Thierry Laborde,$3M est. (exec) (Comparably),Jean-Yves Fillion,$2.5M est. (exec) (Glassdoor),Investment Bankers,5% bonus lift (Bloomberg),Q2 Revenue Leads,€12.2B net income (BNP IR)
Intesa-Sanpaolo,Intesa Sanpaolo,Banking,"Italian banking group offering retail, corporate, and investment services.",https://group.intesasanpaolo.com/en,,,,Carlo Messina,€5M est. (CEO comp) (Economic Times),Rossella Locatelli,€3M est. (exec) (Yahoo),Stefano Barrese,€2.5M est. (exec) (Business Standard),Dividend Shareholders,€3.7B accrued (Intesa IR),H1 Net Income Leads,€5.2B (Intesa IR)
Mitsubishi,Mitsubishi,Conglomerate,"Japanese multinational conglomerate in automotive, finance, and energy.",https://www.mitsubishi.com/en/,,,,Takehiko Kakiuchi,¥500M est. (CEO comp) (Statista),Automotive Execs,$45M partnership review (The Age),Challenger Brand Leads,$ value-based bidding (YouTube),Innovation Partners,$ millions in growth (YouTube),Top Models Buyers,$ exceptional value (Mitsubishi)
Wayfair,Wayfair,E-commerce,"Online retailer of furniture, decor, and home improvement products.",https://www.wayfair.com/,,,,Kelly Clarkson,$1M est. (campaign) (Investor Wayfair),Hollywood Celebs,$ millions in equity (Forbes),Social Media Stars,$4% sales boost (Forbes),Affirm Partners,$ long-standing value (Yahoo),Influencer Collabs,$ credibility growth (Wayfair IR)
