id,name,category,description,website,location,latitude,longitude,affiliate1,$affiliate1,affiliate2,$affiliate2,affiliate3,$affiliate3,affiliate4,$affiliate4,affiliate5,$affiliate5
Connections-Academy,Connections Academy,Education,Online public K-12 virtual schooling program.,https://www.connectionsacademy.com/,,,,James Rhyu,Undisclosed (CEO),Gregory L. Ricks,Undisclosed (Exec),HOSA Partners,Undisclosed (Healthcare),FBLA Affiliates,Undisclosed (Business),Coursera Collaborators,Undisclosed (Courses)
Microsoft-Teams,Microsoft Teams,Collaboration,Cloud-based team communication and collaboration tool.,https://www.microsoft.com/en-us/microsoft-teams/,,,,Jay Leno,Undisclosed (Ads) (SeattleBusiness),Conan O'Brien,Undisclosed (Ads) (SeattleBusiness),Satya Nadella,Undisclosed (CEO),Bill Gates,Undisclosed (Founder),Steven Spielberg,Undisclosed (Partner)
Toptal,Toptal,Freelance,Network connecting businesses with top freelance talent.,https://www.toptal.com/,,,,Taso Du Val,Undisclosed (Founder),Breanden Beneschott,Undisclosed (Co-Founder),Hayden Brown,Undisclosed (CEO),Josh Abramson,Undisclosed (Co-Founder),Manav Sachdeva,Undisclosed (Exec)
Lucid-Motors,Lucid Motors,Automotive,Manufacturer of luxury electric vehicles.,https://www.lucidmotors.com/,,,,Timothée Chalamet,Multi-year est. $5M+ (Yahoo),Jeff Bezos,Undisclosed (Investor),Peter Rawlinson,Undisclosed (CEO),Riley Hall,Undisclosed (Exec),Tony Alva,Undisclosed (Ambassador)
Aerie,Aerie,Apparel,Body-positive intimates and activewear brand.,https://www.aerie.com/,,,,Sydney Sweeney,$7.5M+ annual (BrandVM),Hari Nef,Undisclosed (Role Model) (Fashionista),Beanie Feldstein,Undisclosed (Role Model) (Fashionista),Lana Condor,Undisclosed (Role Model) (Fashionista),Ali Stroker,Undisclosed (Role Model) (Fashionista)
Weight-Watchers,Weight Watchers,Health,Weight management and wellness program.,https://www.weightwatchers.com/,,,,Oprah Winfrey,$43M stake (Guardian),DJ Khaled,Undisclosed (CBS),Jessica Simpson,$5M+ est. (ETOnline),Jennifer Hudson,$5M+ est. (ETOnline),Marie Osmond,Undisclosed (ETOnline)
Blue-Origin,Blue Origin,Aerospace,Private spaceflight and rocket development company.,https://www.blueorigin.com/,,,,Jeff Bezos,Undisclosed (Founder),Katy Perry,Undisclosed (Flyer) (Reddit),Gayle King,Undisclosed (Flyer) (Reddit),Space Force Partners,$5.6B contracts (OpenSecrets),NASA Collaborators,Undisclosed (Partnerships)
Sberbank,Sberbank,Banking,Largest Russian bank offering financial services.,https://www.sberbank.com/,,,,German Gref,Undisclosed (CEO),Alexander Vedashenko,Undisclosed (Exec),David Rafalovsky,Undisclosed (Exec),Stanislav Bliznyuk,Undisclosed (Exec),Anatoly Popov,Undisclosed (Exec)
ByteDance,ByteDance,Technology,Tech company behind TikTok and other apps.,https://www.bytedance.com/,,,,Zhang Yiming,Undisclosed (Founder),Kylie Jenner,$150K/post (MarketRealist),Charli D'Amelio,$100K/post (MarketRealist),Bella Poarch,$100K/post (MarketRealist),Stokes Twins,$150K/post (MarketRealist)
CEMEX,CEMEX,Construction,Global building materials and cement producer.,https://www.cemex.com/,,,,Fernando González,Undisclosed (CEO),Maher Al-Haffar,Undisclosed (Exec),Marisol Argüelles,Undisclosed (Exec),Ricardo Naya,Undisclosed (Exec),Cemex Ventures,Undisclosed (Startups)
Rogers-Communications,Rogers Communications,Telecommunications,"Canadian provider of wireless, cable, and media services.",https://www.rogers.com/,,,,Tony Staffieri,Undisclosed (CEO),Edward Rogers,Undisclosed (Exec),Glenn Brandt,Undisclosed (Exec),Ronald Orr,Undisclosed (Exec),Lourdes Agapay,Undisclosed (Exec)
BMW,BMW,Automotive,German luxury vehicle and motorcycle manufacturer.,https://www.bmw.com/,,,,Serena Williams,$5M+ est. (BMW Brochures),Sydney Sweeney,Undisclosed (Quartz),Beyoncé,Undisclosed (Quartz),Clive Owen,Undisclosed (InfluencerIntelligence),Gigi Hadid,Undisclosed (InfluencerIntelligence)
Infosys,Infosys,IT Services,Global leader in IT consulting and outsourcing.,https://www.infosys.com/,,,,Salil Parekh,Undisclosed (CEO),Australian Open Stars,Undisclosed (Tennis Partners),Roland-Garros Players,Undisclosed (Tennis),Ravi Kumar S,Undisclosed (Exec),Michael Reh,Undisclosed (Exec)
Goya-Foods,Goya Foods,Food,Leading Hispanic-owned food company.,https://www.goya.com/,,,,Robert Unanue,Undisclosed (CEO),Joseph Unanue,Undisclosed (Exec),Charles Unanue,Undisclosed (Exec),Francisco Unanue,Undisclosed (Exec),Anthony Unanue,Undisclosed (Exec)
Target,Target,Retail,Major U.S. discount retailer of general merchandise.,https://www.target.com/,,,,Chip Gaines,Undisclosed (Partnership),Joanna Gaines,Undisclosed (Partnership),Jennifer Lopez,$5M+ est. (Forbes),Ulta Beauty Partners,Undisclosed (Beauty),Goodfellow Collab,Undisclosed (Fashion)
Neuralink,Neuralink,Neurotech,Developer of implantable brain-machine interfaces.,https://neuralink.com/,,,,Elon Musk,Undisclosed (Founder),ARK Invest,$650M round (Neuralink),Founders Fund,Undisclosed (Investor),DFJ Growth,Undisclosed (Investor),G42,Undisclosed (Investor)
Blaze-Pizza,Blaze Pizza,Food,Fast-casual build-your-own pizza chain.,https://www.blazepizza.com/,,,,LeBron James,$35M stake (Forbes),Maverick Carter,Undisclosed (Investor),Rick Wetzel,Undisclosed (Co-Founder),Elise Wetzel,Undisclosed (Co-Founder),Jim Mizes,Undisclosed (Exec)
Black-Rifle-Coffee-Company,Black Rifle Coffee Company,Beverage,Veteran-founded premium coffee brand.,https://www.blackriflecoffee.com/,,,,Evan Hafer,Undisclosed (Founder),Sean Hannity,Undisclosed (Endorser) (NYT),Donald Trump Jr.,Undisclosed (Endorser) (NYT),Ben Shapiro,Undisclosed (Influencer) (SBI),Tom Lauren,Undisclosed (Influencer) (SBI)
Meta,Meta,Social Media,Operator of social networking platforms like Facebook and Instagram.,https://about.meta.com/,,,,Mark Zuckerberg,$100B+ stake (Forbes),Sheryl Sandberg,Undisclosed (former COO),Kylie Jenner,$150K/post est. (MarketRealist),Cristiano Ronaldo,$100K/post est. (MarketRealist),Selena Gomez,$100K/post est. (MarketRealist)
Cabela's,Cabela's,Outdoor Retail,"Outdoor sporting goods retailer specializing in hunting, fishing, and camping gear.",https://www.cabelas.com/,,,,Johnny Morris,Undisclosed (founder via Bass Pro),Lavell Crawford,Undisclosed (Bassmaster),Emil Wagner,Undisclosed (AnglersChannel),Dakota Ebare,Undisclosed (Bassmaster),Kevin VanDam,Undisclosed (MLF)
Northrop-Grumman,Northrop Grumman,Aerospace & Defense,Global aerospace and defense technology company.,https://www.northropgrumman.com/,,,,Kathy Warden,$20M+ package (FierceAerospace),Tom Cruise,$0 paid (organic films),Will Smith,$0 paid (organic films),Harrison Ford,$0 paid (organic films),Christopher Calio,Undisclosed (exec)
Costco,Costco,Retail,"Membership warehouse club selling bulk groceries, electronics, and household items.",https://www.costco.com/,,,,Mark Zuckerberg,$0 paid (organic shopper),Billie Eilish,$0 paid (organic fan),John Mayer,$0 paid (organic visitor),Jimmy Kimmel,$0 paid (organic promoter),Jessica Alba,$0 paid (organic advocate)
Tyson-Foods,Tyson Foods,Food & Beverage,"Leading producer of chicken, beef, pork, and prepared foods.",https://www.tysonfoods.com/,,,,Donnie King,Undisclosed (CEO),John Tyson,Undisclosed (exec),Noel White,Undisclosed (exec),Curt Calaway,Undisclosed (exec),Wes Morris,Undisclosed (exec)
Saffron-Road,Saffron Road,Food & Beverage,Producer of halal-certified frozen meals and ethnic foods.,https://www.saffronroad.com/,,,,Adnan Durrani,Undisclosed (founder),Sanjeev Amre,Undisclosed (board),Sheila E.,Undisclosed (partner),Rumi Spice Partners,Undisclosed (collaboration),Halal Advocates,Undisclosed (endorsers)
Starbucks,Starbucks,Food & Beverage,"Global coffeehouse chain offering beverages, pastries, and snacks.",https://www.starbucks.com/,,,,Brian Niccol,Undisclosed (CEO),Taylor Swift,Undisclosed (organic collab),Ariana Grande,Undisclosed (past collab),Blackpink,Undisclosed (collab),LA28 Olympics,Undisclosed (partner)
DharmaCrafts,DharmaCrafts,Retail,"Supplier of meditation cushions, Buddhist statues, and spiritual gifts.",https://dharmacrafts.com/,,,,Howie Winik,Undisclosed (founder),Zafu Influencers,Undisclosed (affiliates),Meditation Teachers,Undisclosed (partners),Yoga Instructors,Undisclosed (endorsers),Buddhist Leaders,Undisclosed (supporters)
Lowe's,Lowe's,Home Improvement,"Home improvement retailer offering tools, appliances, and building materials.",https://www.lowes.com/,,,,Marvin Ellison,$15M+ package (Bloomberg),Lionel Messi,Undisclosed (partnership),Resideo,Undisclosed (vendor),Weber,Undisclosed (vendor),GE Appliances,Undisclosed (vendor)
General-Motors,General Motors,Automotive,American multinational corporation producing vehicles and mobility solutions.,https://www.gm.com/,,,,Mary Barra,$29M/year (Forbes),Magna,Undisclosed (supplier),Rick Hendrick,Undisclosed (dealer),Mary Beth Whitman,Undisclosed (exec),Rory Harvey,Undisclosed (exec)
Duolingo,Duolingo,Education,Language-learning app using gamification and AI.,https://www.duolingo.com/,,,,Luis von Ahn,Undisclosed (co-founder),Severin Hacker,Undisclosed (co-founder),Zaria Parvez,Undisclosed (exec),Yi Wang,Undisclosed (exec),LinkedIn Partners,Undisclosed (integration)
Planet-Fitness,Planet Fitness,Fitness,Gym chain promoting a judgment-free fitness environment.,https://www.planetfitness.com/,,,,Craig Benson,Undisclosed (CEO),Stephen Kindler Jr.,Undisclosed (franchisee),Hockey Canada,Undisclosed (partner),Boys & Girls Clubs,Undisclosed (initiative),National Fitness Partners,Undisclosed (franchise)
Fitbit,Fitbit,Wearables,Fitness tracker and health monitoring wearable brand.,https://www.fitbit.com/,,,,James Park,Undisclosed (co-founder),Fitbit Influencers,$10K+ est. (StackInfluence),Health Bloggers,Undisclosed (partnerships),Mom Influencers,Undisclosed (campaigns),Retail Partners,Undisclosed (Best Buy etc.)
BetterHelp,BetterHelp,Mental Health,Online therapy platform connecting users with licensed counselors.,https://www.betterhelp.com/,,,,Alon Matas,Undisclosed (co-founder),Danny Bragonier,Undisclosed (co-founder),Demi Lovato,Undisclosed (advocate),Michael Phelps,$1M+ est. (AdAge),Jonny Kim,Undisclosed (advocate)
Telegram,Telegram,Messaging,Secure messaging app with channels and bots.,https://telegram.org/,,,,Pavel Durov,Undisclosed (founder),Top Channels,Undisclosed (monetization),Crypto Influencers,$100K+ est. (CoinGape),Business Groups,Undisclosed (communities),Ad Platforms,Undisclosed (RichAds)
Brave,Brave,Browser,Privacy-focused web browser with ad-blocking.,https://brave.com/,,,,Brendan Eich,Undisclosed (founder),BAT Rewards Users,Undisclosed (incentives),Crypto Partners,Undisclosed (integrations),Influencer Endorsers,Undisclosed (campaigns),Tech Advocates,Undisclosed (supporters)
Walmart,Walmart,Retail,Multinational retail corporation operating hypermarkets and e-commerce.,https://www.walmart.com/,,,,Doug McMillon,$25M+ package (Bloomberg),OpenAI,Undisclosed (partnership),Chip Gaines,Undisclosed (collab),Joanna Gaines,Undisclosed (collab),Jennifer Lopez,$5M+ est. (Forbes)
L'Oréal,L'Oréal,Cosmetics,Global leader in beauty and cosmetics products.,https://www.loreal.com/,,,,Nicolas Hieronimus,€5M+ est. (Statista),Priyanka Chopra,$10M+ lifetime (Forbes),Zendaya,$5M+ est. (campaigns),Eva Longoria,Undisclosed (ambassador),Kate Winslet,Undisclosed (ambassador)
EssilorLuxottica,EssilorLuxottica,Eyewear,Global leader in vision care and eyewear manufacturing.,https://www.essilorluxottica.com/,,,,Johnny Depp,$20M lifetime (Ray-Ban) (Forbes est.),Tom Cruise,$1M+ est. (Ray-Ban) (Luxury Society),Beyoncé,$5M est. (Oakley) (Vogue Business),Leonardo DiCaprio,$2M est. (Ray-Ban) (Yahoo),Ariana Grande,Undisclosed (EssilorLuxottica)
Nintendo,Nintendo,Gaming,Japanese video game console and software developer.,https://www.nintendo.com/,,,,Jimmy Fallon,$1M+ (mobile ads) (MobileGamer),Shakira,$1M+ (mobile ads) (MobileGamer),Kaley Cuoco,$500K est. (ads) (MobileGamer),Jack Black,$0 paid (organic) (CBR),Chrissy Teigen,$0 paid (organic) (CBR)
NBCUniversal,NBCUniversal,Media,"Entertainment and media conglomerate with TV, film, and streaming.",https://www.nbcuniversal.com/,,,,Dwayne Johnson,$20M+ (films) (Variety),Scarlett Johansson,$40M+ (ties) (Variety),Chris Pratt,$15M+ (Jurassic) (Variety),Julia Roberts,$20M est. (BuzzFeed),Jonathan Bailey,$2M (FandomWire)
Fanatics,Fanatics,Sports Merchandise,Online retailer of licensed sports apparel and memorabilia.,https://www.fanatics.com/,,,,Tom Brady,$250K (card deal) (Fanatics),Shohei Ohtani,$60M (New Balance tie) (BrandVM),Eli Manning,$7M/year total (Opendorse),Caitlin Clark,Undisclosed (WNBA) (Fanatics),Michael Rubin,Undisclosed (CEO)
Vertex-Pharmaceuticals,Vertex Pharmaceuticals,Biotechnology,Developer of therapies for cystic fibrosis and rare diseases.,https://www.vrtx.com/,,,,Christopher Viehbacher,$10M+ (package) (FiercePharma),Anthony Edwards,$25M (Jordan + Vertex) (AOL),Michael J. Fox,$0 paid (advocate) (Yahoo),Priyanka Chopra,Undisclosed (ambassador),Robin Roberts,Undisclosed (spokesperson)
Dell-Technologies,Dell Technologies,Technology,Multinational computer technology and IT services company.,https://www.dell.com/,,,,Yara Shahidi,£18K social value (InfluencerIntelligence),Ashton Kutcher,Undisclosed (investor) (Forbes),Michael Dell,Undisclosed (founder stake),Serena Williams,Undisclosed (partner) (Forbes),David Beckham,Undisclosed (partner) (Forbes)
Carnival-Corporation,Carnival Corporation,Travel,World's largest cruise ship operator.,https://www.carnivalcorp.com/,,,,Micky Arison,Undisclosed (chairman stake),Josh Weinstein,Undisclosed (CEO),Arnold Donald,Undisclosed (former CEO),Christine Duffy,Undisclosed (exec),Lars Ljoen,Undisclosed (exec)
Citigroup,Citigroup,Financial Services,Global investment bank and financial services firm.,https://www.citigroup.com/,,,,Jane Fraser,$25M award (Yahoo),John Dugan,Undisclosed (chairman),Mark Mason,Undisclosed (CFO),Viswas Raghavan,Undisclosed (exec),Kweku Adoboli,Undisclosed (exec)
Abbott-Laboratories,Abbott Laboratories,Healthcare,"Multinational medical devices, diagnostics, and nutrition company.",https://www.abbott.com/,,,,Robert B. Ford,$20.6M (Boston Mag),Leonard Schaeffer,Undisclosed (exec),Hubie Kelsey,Undisclosed (exec),Brian Blaser,Undisclosed (exec),Robert H. Reeder Jr.,Undisclosed (exec)
Cardinal-Health,Cardinal Health,Healthcare,Distributor of pharmaceuticals and medical products.,https://www.cardinalhealth.com/,,,,Jason Hollar,Undisclosed (CEO),Tom Garmon,Undisclosed (exec),Dave Bernauer,Undisclosed (former CEO),Mike Kaufmann,Undisclosed (exec),Steve Howell,Undisclosed (exec)
PNC-Financial-Services,PNC Financial Services,Financial Services,Regional bank offering personal and business financial services.,https://www.pnc.com/,,,,William S. Demchak,Undisclosed (CEO),Robert Q. Reilly,Undisclosed (exec),E. William Parsley,Undisclosed (exec),Gregory H. Kozich,Undisclosed (exec),Deborah Hope,Undisclosed (exec)
PureTalk,PureTalk,Telecommunications,Affordable MVNO using AT&T network.,https://www.puretalk.com/,,,,Sean Hannity,$100K est. (endorser) (PureTalk),Ben Shapiro,$100K est. (endorser) (PureTalk),Mark Levin,$100K est. (endorser) (PureTalk),Mike Rowe,Undisclosed (iSpot),Dennis Prager,$100K est. (endorser) (PureTalk)
New-York-Post,New York Post,Media,Tabloid newspaper owned by News Corp.,https://nypost.com/,,,,Emma Tucker,Undisclosed (editor),Keith Poole,Undisclosed (exec),Colin Moynihan,Undisclosed (exec),Joe Concha,Undisclosed (columnist),Miranda Devine,Undisclosed (columnist)
Liberty-Broadband,Liberty Broadband,Telecommunications,Holding company with stakes in Charter Communications.,https://www.libertybroadband.com/,,,,Greg Maffei,Undisclosed (CEO),John Malone,Undisclosed (chairman),Michael Rapino,Undisclosed (exec),Niel Ransom,Undisclosed (exec),Albert Rosenthal,Undisclosed (exec)
Focus-on-the-Family,Focus on the Family,Nonprofit,Christian organization supporting family values and parenting.,https://www.focusonthefamily.com/,,,,Jim Daly,Undisclosed (president),Kirk Cameron,$0 paid (ambassador) (Forbes est.),Tim Tebow,$0 paid (supporter) (Forbes est.),Candace Owens,$0 paid (supporter) (Forbes est.),Tucker Carlson,$0 paid (supporter) (Forbes est.)
Kraken,Kraken,Cryptocurrency,Cryptocurrency exchange and trading platform.,https://www.kraken.com/,,,,David Ripley,Undisclosed (CEO),Snoop Dogg,$1M est. (crypto) (Kraken),Mark Cuban,Undisclosed (investor) (Kraken),Elon Musk,$0 paid (supporter) (Kraken),Changpeng Zhao,Undisclosed (rival)
Daiya-Foods,Daiya Foods,Food & Beverage,Producer of plant-based cheese and dairy alternatives.,https://daiyafoods.com/,,,,Adnan Durrani,Undisclosed (founder),Sanjeev Amre,Undisclosed (board),Sheila E.,Undisclosed (partner),Rumi Spice Partners,Undisclosed (collaboration),Otsuka (acquirer),$325M (FoodDive)
Alpha-Omega,Alpha Omega,Education,Christian homeschool curriculum provider.,https://www.alphaomegaacademy.com/,,,,Doug Lawrence,Undisclosed (CEO),Homeschool Influencers,$10K est. (affiliates) (THSC),Parent Educators,Undisclosed (community),Curriculum Authors,Undisclosed (contributors),Faith-Based Leaders,Undisclosed (supporters)
National-Express,National Express,Transportation,Operator of bus and coach services in the UK and North America.,https://www.nationalexpress.com/,,,,Greg Lewis,Undisclosed (CEO),Rishi Sunak,Undisclosed (advisor) (Reuters est.),Transport Partners,Undisclosed (collaborators),Local Influencers,Undisclosed (campaigns),Sustainability Advocates,Undisclosed (endorsers)
Peter-Do,Peter Do,Fashion,Luxury fashion brand specializing in clean tailoring and genderless designs.,https://peterdo.net/,,,,Zendaya,$500K+ est. (Vogue),Hailey Bieber,Undisclosed (The Cut),Phoebe Philo,Undisclosed (mentor) (Vogue Business),Gigi Hadid,Undisclosed (fan) (L'Officiel),Addison Rae,Undisclosed (wearer) (Instagram)
Etsy,Etsy,E-commerce,Online marketplace for unique handmade and vintage items.,https://www.etsy.com/,,,,Kacey Musgraves,Undisclosed (collab) (Muse by Clio),Breanna Stewart,Undisclosed (partnership) (Muse by Clio),Oprah Winfrey,Undisclosed (past collab) (Etsy),Reese Witherspoon,Undisclosed (recommendations) (Etsy),Jonathan Van Ness,Undisclosed (collab) (Reddit)
Democratic-Socialists-of-America,Democratic Socialists of America,Political Organization,Largest socialist organization advocating for democratic socialism in the US.,https://www.dsausa.org/,,,,Bernie Sanders,$0 paid (supporter) (DSA),Alexandria Ocasio-Cortez,$0 paid (endorsee) (Ballotpedia),Zohran Mamdani,$0 paid (candidate) (Guardian),Rashida Tlaib,$0 paid (member) (Wikipedia),Cori Bush,$0 paid (member) (Wikipedia)
Oculus,Oculus,Virtual Reality,VR headset and platform now part of Meta Quest ecosystem.,https://www.meta.com/quest/,,,,MrBeast,Undisclosed (YouTube promo) (VRDB),Mark Zuckerberg,Undisclosed (Meta CEO) (PCMag),Palmer Luckey,Undisclosed (founder legacy) (Wikipedia),John Carmack,Undisclosed (CTO) (IGN),Brendan Iribe,Undisclosed (co-founder) (GamesRadar)
Paramount-Global,Paramount Global,Media Conglomerate,"Entertainment company producing films, TV, and streaming content.",https://www.paramount.com/,,,,Trey Parker & Matt Stone,$1.25B (South Park) (LA Times),Duffer Brothers,Undisclosed (Stranger Things) (LA Times),UFC (Dana White),$7.7B (partnership) (FandomWire),Shari Redstone,Undisclosed (exec) (Reuters),Bob Bakish,Undisclosed (former CEO) (Statista)
Nvidia,Nvidia,Semiconductors,Designer of graphics processing units and AI platforms.,https://www.nvidia.com/,,,,Jensen Huang,$69M package (Fortune),Satya Nadella (Microsoft),$100B+ stake (GlobalData),Mark Zuckerberg (Meta),$80B+ stake (GlobalData),Nancy Pelosi,$1-5M shares (Moomoo),Lisa Su (AMD rival),Undisclosed (industry) (Bloomberg)
GE-Hitachi,GE Hitachi,Nuclear Energy,Provider of advanced nuclear reactor technology and services.,https://www.gevernova.com/nuclear,,,,Samsung C&T,Undisclosed (alliance) (GE Vernova),TerraPower,Undisclosed (collaboration) (GE),Ontario Power Generation,Undisclosed (SMR contract) (Utility Dive),Aecon Group,Undisclosed (SMR) (OPG),SNC-Lavalin,Undisclosed (SMR) (Utility Dive)
Doctor-on-Demand,Doctor on Demand,Telehealth,Platform offering virtual doctor visits and mental health support.,https://doctorondemand.com/,,,,Jason Gorevic,Undisclosed (former CEO) (Telehealth.com),David Sides,Undisclosed (exec) (GoodRx),Kathleen Barnes,Undisclosed (exec) (CNET),Chris Altchek,Undisclosed (founder) (Healthline),GoodRx Partners,Undisclosed (integration) (GoodRx)
Excelsior-Academy,Excelsior Academy,Education,Christian homeschool program providing online classes and curriculum.,https://excelsiorclasses.com/,,,,Doug Lawrence,Undisclosed (CEO) (Homeschool.com),Homeschool Influencers,$10K est. (affiliates) (Facebook),Parent Educators,Undisclosed (community) (Excelsior),Curriculum Authors,Undisclosed (contributors) (The Homeschool Mom),Grace Community Church,Undisclosed (co-op) (The Homeschool Mom)
Google-Workspace,Google Workspace,Productivity Software,Cloud-based suite for business collaboration and productivity.,https://workspace.google.com/,,,,Sundar Pichai,Undisclosed (Google CEO) (Google),Marc Benioff (Salesforce),Undisclosed (partner) (IDC),Satya Nadella (Microsoft),Undisclosed (rival/partner) (Google),Startups (via Perks),Up to $350K credits (Google Cloud),Nonprofits,Discounts up to 50% (Promevo)
Freelancer.com,Freelancer.com,Freelance Platform,Online marketplace connecting freelancers with clients worldwide.,https://www.freelancer.com/,,,,Taso Du Val,Undisclosed (founder) (Freelancer),Breanden Beneschott,Undisclosed (co-founder) (Quora),Top Freelancers (Rising Star),$5-10K/month est. (Freelancer Blog),Preferred Freelancers,3% top earners (Freelancer),High-Paying Clients,$2.5K avg. project (Nick Wolny)
Polestar,Polestar,Automotive,Swedish manufacturer of premium electric vehicles.,https://www.polestar.com/,,,,Oscar Isaac,Undisclosed (endorser) (CleanTechnica),Jeff Bezos,Undisclosed (investor via Volvo) (Yahoo),Hertz,$65K vehicles (CNN),Alexander Polli (Polestar Arctic),Undisclosed (ambassador) (Polestar),Super Bowl Advertisers,Undisclosed (campaign) (AutoNews)
Old-Navy,Old Navy,Apparel,Affordable casual clothing brand for the whole family under Gap Inc.,https://oldnavy.gap.com/,,,,Chip Gaines,Undisclosed (partnership) (Gap Inc.),Joanna Gaines,Undisclosed (partnership) (Gap Inc.),Jennifer Lopez,$5M+ est. (Forbes),Ulta Beauty,Undisclosed (beauty collab) (LinkedIn),Goodfellow,Undisclosed (fashion) (Gap Inc.)
O-Magazine,O Magazine,Media,Lifestyle magazine empowering women through stories and advice.,https://www.oprahdaily.com/,,,,Oprah Winfrey,Undisclosed (founder) (Oprah Daily),Elizabeth Gilbert,Undisclosed (book club) (Oprah Daily),Barack Obama,Undisclosed (endorsement) (ABC News),Dr. Phil,Undisclosed (contributor) (ABC News),Dr. Mehmet Oz,Undisclosed (contributor) (ABC News)
Washington-Post,Washington Post,Media,"Leading US newspaper covering politics, business, and world news.",https://www.washingtonpost.com/,,,,Jeff Bezos,Undisclosed (owner) (Wikipedia),David Ignatius,Undisclosed (columnist) (Washington Post),E.J. Dionne Jr.,Undisclosed (columnist) (Washington Post),Megan McArdle,Undisclosed (columnist) (Washington Post),Ruth Marcus,Undisclosed (columnist) (Washington Post)
WeChat,WeChat,Messaging App,"Multi-purpose app for messaging, social media, and payments in China.",https://www.wechat.com/,,,,Top KOLs (Beauty),$10K+ per post est. (Launchmetrics),Laudya Cynthia Bella,Undisclosed (influencer) (Jing Daily),Prilly Latuconsina,Undisclosed (influencer) (Jing Daily),Gisella Anastasia,Undisclosed (influencer) (Jing Daily),Adhisty Zara,Undisclosed (influencer) (Jing Daily)
Grupo-Modelo,Grupo Modelo,Beverage,Mexican brewery producing Corona and Modelo beers.,https://www.grupomodelo.com/,,,,Pedro Pascal,Undisclosed (ambassador) (Marketing Dive),Peso Pluma,Undisclosed (ambassador) (Brewbound),Snoop Dogg,Undisclosed (past) (Marketing Dive),Zoe Saldaña,Undisclosed (ad) (Ad Age),Francisco Lindor,Undisclosed (ad) (Ad Age)
Loblaws,Loblaws,Grocery Retail,Leading Canadian supermarket chain with various banners.,https://www.loblaws.ca/,,,,Galen Weston Jr.,Undisclosed (exec) (Wikipedia),Flashfood,$50M+ savings (And Now U Know),DoorDash,Undisclosed (delivery) (Strategy Online),Gatik,Undisclosed (autonomous) (Gatik),Food Banks Canada,$1B+ donations (Loblaw)
Vodafone,Vodafone,Telecommunications,Multinational mobile and fixed-line telecom provider.,https://www.vodafone.com/,,,,Emma Raducanu,£3M (SportsPro),Mary Kom,Undisclosed (global) (Times of India),Akshay Kumar,Undisclosed (Vodafone Idea) (IIDE),Martin Freeman,Undisclosed (campaign) (Vodafone),AI Influencer (Germany),2M views (SmartCompany)
Mercedes-Benz,Mercedes-Benz,Automotive,German luxury automobile manufacturer.,https://www.mercedes-benz.com/,,,,Coco Gauff,$90M est. (YouTube),Bernhard Langer,Undisclosed (ambassador) (Mercedes-Benz),Ludvig Åberg,Undisclosed (golf) (Mercedes-Benz),Sydney Sweeney,Undisclosed (Quartz),Beyoncé,Undisclosed (Quartz)
Wipro,Wipro,IT Services,"Global IT consulting, digital transformation, and business process services.",https://www.wipro.com/,,,,Alight Solutions,$1.5B deal (Digitalisation World),AWS,Undisclosed (alliance) (Wipro),Dell,Undisclosed (360 partnership) (Wipro),Cisco,Undisclosed (partner) (Wipro),Metro Cash & Carry,Undisclosed (Google Cloud) (Google Cloud)
Overstock,Overstock,E-commerce,"Online retailer specializing in home goods, furniture, and decor at discount prices.",https://www.overstock.com/,,,,Patrick Byrne,Undisclosed (founder) (Forbes),Jonathan Johnson,Undisclosed (CEO) (Yahoo),Vanguard Group,$500M+ stake est. (MarketBeat),Taylor Swift,Undisclosed (general retail) (AInvest),Zendaya,Undisclosed (fashion tie-in) (Forbes)
